"RicNumero"|"RicProtocollo"|"RicData"|"RicDataConsegna"|"RicOrdineNumero"|"RicOrdineData"|"RicCodiceFornitore"|"RicRagSocFornitore"|"RicAnaArtCodice"|"RicAnaArtDescrizione"|"RicQuantitaOrdinata"|"RicQuantitaRicevuta"
"PO31841"|"2528217"|"20170317"|"20170317"|"PO31841"|"20170306"|"FO20170306_PO31841"|"Esthex"|"RB3A009456"|"ESTHEX-030520-Sonaglio Blu Mosca Peter"|"0000000002"|"0000000001"
"PO31871"|"2529217"|"20170317"|"20170317"|"PO31871"|"20170310"|"FO20170310_PO31871"|"Liliputi"|"RB3A017516"|"LILIPUTI-2006002020150-Marsupio Rainbow Line Skully"|"0000000001"|"0000000001"
"PO31871"|"2529217"|"20170317"|"20170317"|"PO31871"|"20170310"|"FO20170310_PO31871"|"Liliputi"|"RB3A017523"|"LILIPUTI-2006003010143-Marsupio Mei Tai Skully"|"0000000001"|"0000000001"
"PO31871"|"2529217"|"20170317"|"20170317"|"PO31871"|"20170310"|"FO20170310_PO31871"|"Liliputi"|"RB3A017526"|"LILIPUTI-2006003010051-Marsupio Mei Tai Folk Tale"|"0000000002"|"0000000002"
"PO31871"|"2529217"|"20170317"|"20170317"|"PO31871"|"20170310"|"FO20170310_PO31871"|"Liliputi"|"RB3A017527"|"LILIPUTI-2006003010105-Marsupio Mei Tai Elegance"|"0000000001"|"0000000001"
"PO31871"|"2529217"|"20170317"|"20170317"|"PO31871"|"20170310"|"FO20170310_PO31871"|"Liliputi"|"RB3A017559"|"LILIPUTI-2006001060010-Babbucce Neonato Favola della Foresta XXS 0-4 mesi"|"0000000001"|"0000000001"
"PO31872"|"2527217"|"20170317"|"20170317"|"PO31872"|"20170310"|"FO20170310_PO31872"|"limobasics"|"RB3A014304"|"LIMOBASICS-52685SMAG 86-92-Felpina Magenta 86-92"|"0000000001"|"0000000001"
