"RicNumero"|"RicProtocollo"|"RicData"|"RicDataConsegna"|"RicOrdineNumero"|"RicOrdineData"|"RicCodiceFornitore"|"RicRagSocFornitore"|"RicAnaArtCodice"|"RicAnaArtDescrizione"|"RicQuantitaOrdinata"|"RicQuantitaRicevuta"
"PO32570"|"3583217"|"20170718"|"20170718"|"PO32570"|"20170629"|"FO20170629_PO32570"|"Cuddledry"|"RB3A020789"|"CUDDLEDRY-CMO01-Accappatoio Mucca CuddleMoo"|"0000000002"|"0000000002"
"PO32570"|"3583217"|"20170718"|"20170718"|"PO32570"|"20170629"|"FO20170629_PO32570"|"Cuddledry"|"RB3A020790"|"CUDDLEDRY-CSAF01-Accappatoio Giraffa CuddleSafari"|"0000000001"|"0000000002"
"PO32570"|"3583217"|"20170718"|"20170718"|"PO32570"|"20170629"|"FO20170629_PO32570"|"Cuddledry"|"RB3A020791"|"CUDDLEDRY-CRR01-Accappatoio Dinosauro CuddleRoar"|"0000000006"|"0000000006"
"PO32570"|"3583217"|"20170718"|"20170718"|"PO32570"|"20170629"|"FO20170629_PO32570"|"Cuddledry"|"RB3A020792"|"CUDDLEDRY-GR01-Accappatoio con Cappuccio Grey Stars"|"0000000001"|"0000000001"
"PO32570"|"3583217"|"20170718"|"20170718"|"PO32570"|"20170629"|"FO20170629_PO32570"|"Cuddledry"|"RB3A020793"|"CUDDLEDRY-GC01-Accappatoio con Cappuccio Giraffa"|"0000000001"|"0000000003"
"PO32570"|"3583217"|"20170718"|"20170718"|"PO32570"|"20170629"|"FO20170629_PO32570"|"Cuddledry"|"RB3A020794"|"CUDDLEDRY-CC01-Accappatoio con Cappuccio Mucca"|"0000000001"|"0000000001"
"PO32593"|"3584217"|"20170717"|"20170718"|"PO32593"|"20170705"|"FO20170705_PO32593"|"elodie details"|"RB2000PJ"|"ELODIE DETAILS-103311-Copertina Bamboo Grigia Marble Grey"|"0000000003"|"0000000003"
"PO32593"|"3584217"|"20170717"|"20170718"|"PO32593"|"20170705"|"FO20170705_PO32593"|"elodie details"|"RB3A009362"|"ELODIE DETAILS-103622-Borsa con fasciatoio Zebra Sunshine"|"0000000002"|"0000000002"
"PO32593"|"3584217"|"20170717"|"20170718"|"PO32593"|"20170705"|"FO20170705_PO32593"|"elodie details"|"RB3A010098"|"ELODIE DETAILS-103037-Ciuccio Bedouin Stories"|"0000000010"|"0000000010"
"PO32593"|"3584217"|"20170717"|"20170718"|"PO32593"|"20170705"|"FO20170705_PO32593"|"elodie details"|"RB3A010112"|"ELODIE DETAILS-103647-Borsa Shopper Bedouin Stories"|"0000000005"|"0000000005"
"PO32593"|"3584217"|"20170717"|"20170718"|"PO32593"|"20170705"|"FO20170705_PO32593"|"elodie details"|"RB3A010142"|"ELODIE DETAILS-103873-Accappatoio Capo Indiano"|"0000000006"|"0000000006"
"PO32593"|"3584217"|"20170717"|"20170718"|"PO32593"|"20170705"|"FO20170705_PO32593"|"elodie details"|"RB3A013422"|"ELODIE DETAILS-103890-Zaino Marble Grey"|"0000000002"|"0000000002"
"PO32593"|"3584217"|"20170717"|"20170718"|"PO32593"|"20170705"|"FO20170705_PO32593"|"elodie details"|"RB3A018139"|"ELODIE DETAILS-103044-CIUCCIO SWEET HONEY HARRY"|"0000000006"|"0000000006"
"PO32593"|"3584217"|"20170717"|"20170718"|"PO32593"|"20170705"|"FO20170705_PO32593"|"elodie details"|"RB3A018147"|"ELODIE DETAILS-103150-CORDINO CIUCCIO POWDER PINK"|"0000000010"|"0000000010"
"PO32618"|"3581217"|"20170717"|"20170718"|"PO32618"|"20170706"|"FO20170706_PO32618"|"Done By Deer"|"RB3A019469"|"DONE BY DEER-20560-Nido della Tenerezza Grigio"|"0000000001"|"0000000001"
"PO32618"|"3581217"|"20170717"|"20170718"|"PO32618"|"20170706"|"FO20170706_PO32618"|"Done By Deer"|"RB3A019479"|"DONE BY DEER-30658-Fasciatoio Elefante Bianco"|"0000000001"|"0000000001"
"PO32619"|"3582217"|"20170717"|"20170718"|"PO32619"|"20170706"|"FO20170706_PO32619"|"MAKE MY DAY"|"RB3A019492"|"MAKE MY DAY-BB113-Bavaglia in silicone - Monkey"|"0000000002"|"0000000002"
"PO32619"|"3582217"|"20170717"|"20170718"|"PO32619"|"20170706"|"FO20170706_PO32619"|"MAKE MY DAY"|"RB3A019610"|"MAKE MY DAY-BB117-Bavaglia in silicone - Koala"|"0000000002"|"0000000002"
"PO32634"|"3587217"|"20170718"|"20170718"|"PO32634"|"20170710"|"FO20170710_PO32634"|"Funbites"|"RB3A020996"|"FUNBITES-1001-TagliaPappa Mostriciattolo Verde"|"0000000008"|"0000000008"
"PO32634"|"3587217"|"20170718"|"20170718"|"PO32634"|"20170710"|"FO20170710_PO32634"|"Funbites"|"RB3A020997"|"FUNBITES-1002-TagliaPappa Mostriciattolo Giallo"|"0000000008"|"0000000004"
"PO32634"|"3587217"|"20170718"|"20170718"|"PO32634"|"20170710"|"FO20170710_PO32634"|"Funbites"|"RB3A020998"|"FUNBITES-2002-TagliaPappa Mostriciattolo Rosso"|"0000000008"|"0000000008"
"PO32634"|"3587217"|"20170718"|"20170718"|"PO32634"|"20170710"|"FO20170710_PO32634"|"Funbites"|"RB3A020999"|"FUNBITES-2001-TagliaPappa Mostriciattolo Rosa"|"0000000008"|"0000000008"
"PO32634"|"3587217"|"20170718"|"20170718"|"PO32634"|"20170710"|"FO20170710_PO32634"|"Funbites"|"RB3A021000"|"FUNBITES-4001-TagliaPappa Mostriciattolo Arancione"|"0000000008"|"0000000008"
"PO32634"|"3587217"|"20170718"|"20170718"|"PO32634"|"20170710"|"FO20170710_PO32634"|"Funbites"|"RB3A021001"|"FUNBITES-4002-TagliaPappa Mostriciattolo Blu"|"0000000008"|"0000000008"
"PO32635"|"3585217"|"20170718"|"20170718"|"PO32635"|"20170710"|"FO20170710_PO32635"|"Cup Catcher"|"RB3A021004"|"CUP CATCHER-CC01AQ-Cordino salva Bottiglie e Gioco per la Dentizione 2 in 1 Acqua"|"0000000012"|"0000000012"
"PO32635"|"3585217"|"20170718"|"20170718"|"PO32635"|"20170710"|"FO20170710_PO32635"|"Cup Catcher"|"RB3A021005"|"CUP CATCHER-CC08CL-Cordino salva Bottiglie e Gioco per la Dentizione 2 in 1 Corallo"|"0000000018"|"0000000018"
"PO32635"|"3585217"|"20170718"|"20170718"|"PO32635"|"20170710"|"FO20170710_PO32635"|"Cup Catcher"|"RB3A021006"|"CUP CATCHER-CC11LG-Cordino salva Bottiglie e Gioco per la Dentizione 2 in 1 Verde"|"0000000009"|"0000000009"
"PO32635"|"3585217"|"20170718"|"20170718"|"PO32635"|"20170710"|"FO20170710_PO32635"|"Cup Catcher"|"RB3A021007"|"CUP CATCHER-CC12NB-Cordino salva Bottiglie e Gioco per la Dentizione 2 in 1 Blu"|"0000000006"|"0000000006"
"PO32636"|"3586217"|"20170718"|"20170718"|"PO32636"|"20170710"|"FO20170710_PO32636"|"Mouthie Mitten"|"RB3A021008"|"MOUTHIE MITTEN-MM05P-EU-Guantino Massaggia Gengive per la Dentizione Rosa"|"0000000012"|"0000000012"
"PO32636"|"3586217"|"20170718"|"20170718"|"PO32636"|"20170710"|"FO20170710_PO32636"|"Mouthie Mitten"|"RB3A021009"|"MOUTHIE MITTEN-MM04A-EU-Guantino Massaggia Gengive per la Dentizione Aqua"|"0000000030"|"0000000030"
"PO32636"|"3586217"|"20170718"|"20170718"|"PO32636"|"20170710"|"FO20170710_PO32636"|"Mouthie Mitten"|"RB3A021010"|"MOUTHIE MITTEN-MM01G-EU-Guantino Massaggia Gengive per la Dentizione Verde"|"0000000024"|"0000000024"
"PO32636"|"3586217"|"20170718"|"20170718"|"PO32636"|"20170710"|"FO20170710_PO32636"|"Mouthie Mitten"|"RB3A021011"|"MOUTHIE MITTEN-MM02P-EU-Guantino Massaggia Gengive per la Dentizione Viola"|"0000000010"|"0000000010"
"PO32658"|"3589217"|"20170718"|"20170718"|"PO32658"|"20170713"|"FO20170713_PO32658"|"A Little Lovely Company"|"RB3A009901"|"A LITTLE LOVELY COMPANY-LTCW025-Lampada Mini Nuvoletta Bianca"|"0000000010"|"0000000010"
"PO32658"|"3589217"|"20170718"|"20170718"|"PO32658"|"20170713"|"FO20170713_PO32658"|"A Little Lovely Company"|"RB3A009902"|"A LITTLE LOVELY COMPANY-LTCB024-Lampada Mini Nuvoletta Blu"|"0000000005"|"0000000005"
"PO32658"|"3589217"|"20170718"|"20170718"|"PO32658"|"20170713"|"FO20170713_PO32658"|"A Little Lovely Company"|"RB3A009911"|"A LITTLE LOVELY COMPANY-LTIM016-Lampada Mini Gelato Menta"|"0000000005"|"0000000005"
"PO32658"|"3589217"|"20170718"|"20170718"|""|"00000000"|"FO20170713_PO32658"|"A Little Lovely Company"|"RB3A010012"|"A LITTLE LOVELY COMPANY-PBWH001-Sacco Portaoggetti in Carta Bianco"|"0000000000"|"0000000005"
"PO32658"|"3589217"|"20170718"|"20170718"|"PO32658"|"20170713"|"FO20170713_PO32658"|"A Little Lovely Company"|"RB3A012292"|"A LITTLE LOVELY COMPANY-LTBW032-Box Lampada A4 Lightbox per scritte Bianca"|"0000000005"|"0000000005"
"PO32658"|"3589217"|"20170718"|"20170718"|"PO32658"|"20170713"|"FO20170713_PO32658"|"A Little Lovely Company"|"RB3A013052"|"A LITTLE LOVELY COMPANY-LTSM031-Lampada Mini Stella Menta"|"0000000005"|"0000000005"
"PO32658"|"3589217"|"20170718"|"20170718"|"PO32658"|"20170713"|"FO20170713_PO32658"|"A Little Lovely Company"|"RB3A013053"|"A LITTLE LOVELY COMPANY-LTSP030-Lampada Mini Stella Rosa"|"0000000005"|"0000000005"
"PO32658"|"3589217"|"20170718"|"20170718"|"PO32658"|"20170713"|"FO20170713_PO32658"|"A Little Lovely Company"|"RB3A013054"|"A LITTLE LOVELY COMPANY-LTMO028-Lampada Mini Luna"|"0000000005"|"0000000005"
"PO32658"|"3589217"|"20170718"|"20170718"|"PO32658"|"20170713"|"FO20170713_PO32658"|"A Little Lovely Company"|"RB3A014987"|"A LITTLE LOVELY COMPANY-LTGH037-Lampada Mini Fantasmino"|"0000000005"|"0000000005"
"PO32658"|"3589217"|"20170718"|"20170718"|"PO32658"|"20170713"|"FO20170713_PO32658"|"A Little Lovely Company"|"RB3A018390"|"A LITTLE LOVELY COMPANY-LTST047-Lucine LED Colorate Ghiaccioli"|"0000000003"|"0000000003"
"PO32658"|"3589217"|"20170718"|"20170718"|"PO32658"|"20170713"|"FO20170713_PO32658"|"A Little Lovely Company"|"RB3A018392"|"A LITTLE LOVELY COMPANY-LTST048-Lucine LED Colorate Fantasmini"|"0000000003"|"0000000003"
"PO32658"|"3589217"|"20170718"|"20170718"|"PO32658"|"20170713"|"FO20170713_PO32658"|"A Little Lovely Company"|"RB3A018403"|"A LITTLE LOVELY COMPANY-LTCP054-Lampada Mini  Nuvoletta Rosa"|"0000000005"|"0000000005"
"PO32666"|"3588217"|"20170718"|"20170718"|"PO32666"|"20170713"|"FO20170713_PO32666"|"Daikos"|"RB3A020264"|"DAIKOS-SQD217TU10-Pinna da Squalo Nera"|"0000000002"|"0000000002"
"PO32666"|"3588217"|"20170718"|"20170718"|"PO32666"|"20170713"|"FO20170713_PO32666"|"Daikos"|"RB3A020265"|"DAIKOS-SQD217TU60-Pinna da Squalo Rosa"|"0000000002"|"0000000002"
"PO32666"|"3588217"|"20170718"|"20170718"|"PO32666"|"20170713"|"FO20170713_PO32666"|"Daikos"|"RB3A020266"|"DAIKOS-SQD217TU50-Pinna da Squalo Rossa"|"0000000002"|"0000000002"
"PO32672"|"3592217"|"20170718"|"20170718"|"PO32672"|"20170713"|"FO20170713_PO32672"|"KUK"|"RB3A009252"|"KUK-F420-18-Accappatoio Volpe Blu"|"0000000001"|"0000000001"
"PO32672"|"3592217"|"20170718"|"20170718"|"PO32672"|"20170713"|"FO20170713_PO32672"|"KUK"|"RB3A010297"|"KUK-F115-37-Set 2 Copertine 70x60 Elefanti Rosa"|"0000000003"|"0000000003"
"PO32672"|"3592217"|"20170718"|"20170718"|"PO32672"|"20170713"|"FO20170713_PO32672"|"KUK"|"RB3A010298"|"KUK-F115-18-Set 2 Copertine 70x60 Volpe"|"0000000003"|"0000000003"
"PO32672"|"3592217"|"20170718"|"20170718"|"PO32672"|"20170713"|"FO20170713_PO32672"|"KUK"|"RB3A010499"|"KUK-FL325-12-Body a maniche lunghe Balena Blu 6-12 mesi"|"0000000001"|"0000000001"
"PO32672"|"3592217"|"20170718"|"20170718"|"PO32672"|"20170713"|"FO20170713_PO32672"|"KUK"|"RB3A010560"|"KUK-FS338-03-Body Manica corta Elefante Blu 0-3 mesi"|"0000000001"|"0000000001"
"PO32672"|"3592217"|"20170718"|"20170718"|"PO32672"|"20170713"|"FO20170713_PO32672"|"KUK"|"RB3A010939"|"KUK-F110-28-Set 2 Teli Multiuso Balena Rosa 120x120"|"0000000002"|"0000000002"
"PO32672"|"3592217"|"20170718"|"20170718"|"PO32672"|"20170713"|"FO20170713_PO32672"|"KUK"|"RB3A018277"|"KUK-FS352-03-Body Manica corta con  Farfallini Blu-0-3 Mesi"|"0000000001"|"0000000001"
"PO32672"|"3592217"|"20170718"|"20170718"|"PO32672"|"20170713"|"FO20170713_PO32672"|"KUK"|"RB3A018285"|"KUK-FS371-03-Body Manica corta  con Foglie Menta-0-3 Mesi"|"0000000001"|"0000000001"
"PO32672"|"3592217"|"20170718"|"20170718"|"PO32672"|"20170713"|"FO20170713_PO32672"|"KUK"|"RB3A018380"|"KUK-F115-71-Set 2 Teli Multiuso  Foglie Menta 70 x 60-70 x 60 cm"|"0000000002"|"0000000002"
"PO32672"|"3592217"|"20170718"|"20170718"|"PO32672"|"20170713"|"FO20170713_PO32672"|"KUK"|"RB3A018385"|"KUK-F140-25-Set Bavaglino e Telo Antirigurgito Balena  Blu"|"0000000002"|"0000000001"
"PO32674"|"3612217"|"20170718"|"20170718"|"PO32674"|"20170714"|"FO20170714_PO32674"|"Alecto"|"RB3A020854"|"ALECTO-AL-BC16-Repellente insetti a ultrasuoni"|"0000000010"|"0000000010"
"PO32675"|"3611217"|"20170718"|"20170718"|"PO32675"|"20170714"|"FO20170714_PO32675"|"Boon"|"RB3A017495"|"BOON-B373-Scolaposate e Scola Biberon Quadrato"|"0000000004"|"0000000004"
"PO32676"|"3610217"|"20170718"|"20170718"|"PO32676"|"20170714"|"FO20170714_PO32676"|"Bumbo"|"RB3A020732"|"BUMBO-BMB005-Sedile per Bambino con Vassoio Rimovibile Rosa"|"0000000001"|"0000000001"
"PO32676"|"3610217"|"20170718"|"20170718"|"PO32676"|"20170714"|"FO20170714_PO32676"|"Bumbo"|"RB3A020739"|"BUMBO-BMB401-Rialzo da Pavimento e Rialzo da Sedia 2 in 1 Blu"|"0000000001"|"0000000001"
"PO32676"|"3610217"|"20170718"|"20170718"|"PO32676"|"20170714"|"FO20170714_PO32676"|"Bumbo"|"RB3A020740"|"BUMBO-BMB403-Rialzo da Pavimento e Rialzo da Sedia 2 in 1 Rosso"|"0000000001"|"0000000001"
"PO32677"|"3609217"|"20170718"|"20170718"|"PO32677"|"20170714"|"FO20170714_PO32677"|"Magic Bed"|"RB3A020979"|"MAGIC BED-MB070-02-Mini MagicBed ARTIC BLUE"|"0000000004"|"0000000011"
"PO32677"|"3609217"|"20170718"|"20170718"|"PO32677"|"20170714"|"FO20170714_PO32677"|"Magic Bed"|"RB3A020980"|"MAGIC BED-MB070-01-Mini Magic Bed Liberty"|"0000000001"|"0000000001"
"RESO ORD 30333"|"3598217"|"20170718"|"20170718"|""|"00000000"|"00002"|"ROCKETBABY"|"RB3A013433"|"ELODIE DETAILS-103613-Borsa Fasciatoio Black Leather"|"0000000000"|"0000000001"
"RESO ORD 30365"|"3595217"|"20170718"|"20170718"|""|"00000000"|"00002"|"ROCKETBABY"|"RB3A011623"|"BIG MOUTH-BMPFCD-Ciambellone gonfiabile XXL Donut al cioccolato"|"0000000000"|"0000000001"
"RESO ORD 30453"|"3599217"|"20170718"|"20170718"|""|"00000000"|"00002"|"ROCKETBABY"|"RB3A011908"|"KANGA CARE-KC-KRRUMPSOS-P126-Pannolino Rumparooz Dragons Fly"|"0000000000"|"0000000001"
"RESO ORD 30453"|"3599217"|"20170718"|"20170718"|""|"00000000"|"00002"|"ROCKETBABY"|"RB3A018437"|"SUPERGA-S003KU0 _J29-Sneaker Baby Space Blue-18"|"0000000000"|"0000000001"
"RESO ORD 30453"|"3599217"|"20170718"|"20170718"|""|"00000000"|"00002"|"ROCKETBABY"|"RB3A019650"|"FUNKIT WORLD-SBU-01-Funkit World Secchiello da Spiaggia in Silicone Blu"|"0000000000"|"0000000001"
"RESO ORD 30453"|"3599217"|"20170718"|"20170718"|""|"00000000"|"00002"|"ROCKETBABY"|"RB3A019654"|"FUNKIT WORLD-SMO-41-Funkit World Formine per la Sabbia in Silicone Blu"|"0000000000"|"0000000001"
"RESO ORD 30453"|"3599217"|"20170718"|"20170718"|""|"00000000"|"00002"|"ROCKETBABY"|"RB3A019655"|"FUNKIT WORLD-SSP-51-Funkit World Paletta per la Sabbia in Silicone Blu"|"0000000000"|"0000000001"
"RESO ORD 30453"|"3599217"|"20170718"|"20170718"|""|"00000000"|"00002"|"ROCKETBABY"|"RB3A019895"|"SKIP HOP-307501-Libro - BOSCO"|"0000000000"|"0000000001"
"RESO ORD 30469"|"3601217"|"20170718"|"20170718"|""|"00000000"|"00002"|"ROCKETBABY"|"RB3A019613"|"I PLAY-711054-205-44-Iplay Costumino Pannolino Contenitivo Mix'n Match Rosa-18 Mesi"|"0000000000"|"0000000001"
"RESO ORD 30720"|"3591217"|"20170718"|"20170718"|""|"00000000"|"00002"|"ROCKETBABY"|"RB3A020410"|"IGOR SHOES-S10167-006-Sandali con Fiocchetto Mia Celeste-22"|"0000000000"|"0000000001"
"RESO ORD 30720"|"3591217"|"20170718"|"20170718"|""|"00000000"|"00002"|"ROCKETBABY"|"RB3A020485"|"IGOR SHOES-S10167-005-Sandali con Fiocchetto Mia Rosso-22"|"0000000000"|"0000000001"
"RESO ORD 30853"|"3596217"|"20170718"|"20170718"|""|"00000000"|"00002"|"ROCKETBABY"|"RB3A008309"|"COQ EN PATE-L15ACCBOBMBPAN-Cappellino Panda S (6-18 mesi)"|"0000000000"|"0000000001"
"RESO ORD 30853"|"3596217"|"20170718"|"20170718"|""|"00000000"|"00002"|"ROCKETBABY"|"RB3A020751"|"DUUKIES BEACH SOCKS-FJ-20-21-Calze in Neoprene Jet-20-21"|"0000000000"|"0000000001"
"RESO ORD 30870"|"3602217"|"20170718"|"20170718"|""|"00000000"|"00002"|"ROCKETBABY"|"RB3A019997"|"IGOR SHOES-S10108-017-Sandali da Spiaggia Cholo Grigio-18"|"0000000000"|"0000000001"
"RESO ORD 30915"|"3603217"|"20170718"|"20170718"|""|"00000000"|"00002"|"ROCKETBABY"|"RB3A019651"|"FUNKIT WORLD-SBU-03-Funkit World Secchiello da Spiaggia in Silicone Verde"|"0000000000"|"0000000001"
"RESO ORD 30915"|"3603217"|"20170718"|"20170718"|""|"00000000"|"00002"|"ROCKETBABY"|"RB3A019657"|"FUNKIT WORLD-SSP-54-Funkit World Paletta per la Sabbia in Silicone Verde Lime"|"0000000000"|"0000000001"
"RESO ORD 30915"|"3603217"|"20170718"|"20170718"|""|"00000000"|"00002"|"ROCKETBABY"|"RB3A019661"|"FUNKIT WORLD-SMR-91-Funkit World Sacca da Spiaggia in Silicone Blu"|"0000000000"|"0000000001"
"RESO ORD 30915"|"3603217"|"20170718"|"20170718"|""|"00000000"|"00002"|"ROCKETBABY"|"RB3A019662"|"FUNKIT WORLD-SMR-92-Funkit World Sacca da Spiaggia in Silicone Rosa"|"0000000000"|"0000000001"
"RESO ORD 30915"|"3603217"|"20170718"|"20170718"|""|"00000000"|"00002"|"ROCKETBABY"|"RB3A019771"|"BIG MOUTH-BMBT-SB-Beach Blanket Strawberry 1.5m NEW"|"0000000000"|"0000000001"
"RESO ORD 30979"|"3607217"|"20170718"|"20170718"|""|"00000000"|"00002"|"ROCKETBABY"|"RB3A019995"|"IGOR SHOES-S10108-003-Sandali da Spiaggia Cholo Blu Navy-34"|"0000000000"|"0000000001"
"RESO ORD 31021"|"3593217"|"20170718"|"20170718"|""|"00000000"|"00002"|"ROCKETBABY"|"RB3A020001"|"IGOR SHOES-S10108-017-Sandali da Spiaggia Cholo Grigio-22"|"0000000000"|"0000000001"
"RESO ORD 31225"|"3597217"|"20170718"|"20170718"|""|"00000000"|"00002"|"ROCKETBABY"|"RB3A010376"|"BABYCAR-550R-FORD RANGER ROSSO"|"0000000000"|"0000000001"
"RESO ORD 31290"|"3590217"|"20170718"|"20170718"|""|"00000000"|"00002"|"ROCKETBABY"|"RB3A020015"|"IGOR SHOES-S10108-090-Sandali da Spiaggia Cholo Rosa-18"|"0000000000"|"0000000001"
"RESO ORD 31307"|"3606217"|"20170718"|"20170718"|""|"00000000"|"00002"|"ROCKETBABY"|"RB3A011638"|"BIG MOUTH-BM1516-Ciambellone gonfiabile XXL Donut alla fragola"|"0000000000"|"0000000001"
"RESO ORD 31579"|"3608217"|"20170718"|"20170718"|""|"00000000"|"00002"|"ROCKETBABY"|"RB3A019922"|"MIAMI KIDS-S15901A-PINK-Sneaker Slip on Baby Rosa-24"|"0000000000"|"0000000001"
"RESO ORD 31579"|"3608217"|"20170718"|"20170718"|""|"00000000"|"00002"|"ROCKETBABY"|"RB3A019956"|"MIAMI KIDS-S15901A-LIGHTBLUE-Sneaker Slip on Baby Azzurro-26"|"0000000000"|"0000000001"
"RESO ORD 31579"|"3608217"|"20170718"|"20170718"|""|"00000000"|"00002"|"ROCKETBABY"|"RB3A019958"|"MIAMI KIDS-S15901A-LIGHTBLUE-Sneaker Slip on Baby Azzurro-28"|"0000000000"|"0000000001"
"RESO ORD 31582"|"3600217"|"20170718"|"20170718"|""|"00000000"|"00002"|"ROCKETBABY"|"RB3A011636"|"BIG MOUTH-BMBTDO-Telo da mare XXL Ciambella alla Fragola"|"0000000000"|"0000000001"
"RESO ORD 31799"|"3594217"|"20170718"|"20170718"|""|"00000000"|"00002"|"ROCKETBABY"|"RB3A008971"|"TYRRELL KATZ-Bicchiere con manici dinosauri"|"0000000000"|"0000000001"
"RESO ORD 31799"|"3594217"|"20170718"|"20170718"|""|"00000000"|"00002"|"ROCKETBABY"|"RB3A008975"|"TYRRELL KATZ-Bicchiere con manici giardino segreto"|"0000000000"|"0000000001"
"RESO ORD 31799"|"3594217"|"20170718"|"20170718"|""|"00000000"|"00002"|"ROCKETBABY"|"RB3A010912"|"CHILDHOME-CWNLJOP2-Giubbottino Salvagente in Neoprene Rosa e Blu 3-6 Anni"|"0000000000"|"0000000001"
"RESO ORD 31799"|"3594217"|"20170718"|"20170718"|""|"00000000"|"00002"|"ROCKETBABY"|"RB3A010913"|"CHILDHOME-CWNLJR1-Giubbottino Salvagente in Neoprene Rosso e Blu 2-3 Anni"|"0000000000"|"0000000001"
"RESO ORD 31799"|"3594217"|"20170718"|"20170718"|""|"00000000"|"00002"|"ROCKETBABY"|"RB3A020733"|"BUMBO-BMB101-Rialzo Baby per Sedia Blu"|"0000000000"|"0000000001"
"RESO ORD 31799"|"3594217"|"20170718"|"20170718"|""|"00000000"|"00002"|"ROCKETBABY"|"RB3A020735"|"BUMBO-BMB105-Rialzo Baby per Sedia Rosa"|"0000000000"|"0000000001"
"RESO ORD 32250"|"3605217"|"20170718"|"20170718"|""|"00000000"|"00002"|"ROCKETBABY"|"RB3A020893"|"BUGLET-OR_BBLR-Bracciale Antizanzare Arancione"|"0000000000"|"0000000001"
"RESO ORD 32250"|"3605217"|"20170718"|"20170718"|""|"00000000"|"00002"|"ROCKETBABY"|"RB3A020894"|"BUGLET-PK_BBLR-Bracciale Antizanzare Rosa"|"0000000000"|"0000000001"
"RESO ORD 32250"|"3605217"|"20170718"|"20170718"|""|"00000000"|"00002"|"ROCKETBABY"|"RB3A020897"|"BUGLET-BL_BBLR-Bracciale Antizanzare Blu"|"0000000000"|"0000000001"
"RESO ORD 32886"|"3604217"|"20170718"|"20170718"|""|"00000000"|"00002"|"ROCKETBABY"|"RB3A020882"|"KG DESIGN-3035-Tovaglietta in Silicone Macchinina Grigia"|"0000000000"|"0000000001"
