"RicNumero"|"RicProtocollo"|"RicData"|"RicDataConsegna"|"RicOrdineNumero"|"RicOrdineData"|"RicCodiceFornitore"|"RicRagSocFornitore"|"RicAnaArtCodice"|"RicAnaArtDescrizione"|"RicQuantitaOrdinata"|"RicQuantitaRicevuta"
"PO31615"|"2204217"|"20170127"|"20170127"|"PO31615"|"20170105"|"FO20170105_PO31615"|"BabyZen"|"RB3A015629"|"BABYZEN-3760222211390-YO YO Color Pack Blu dai 6 mesi"|"0000000001"|"0000000001"
"PO31615"|"2204217"|"20170127"|"20170127"|"PO31615"|"20170105"|"FO20170105_PO31615"|"BabyZen"|"RB3A015630"|"BABYZEN-3760222211437-YO YO Color Pack Nero dai 6 mesi"|"0000000002"|"0000000002"
"PO31615"|"2204217"|"20170127"|"20170127"|"PO31615"|"20170105"|"FO20170105_PO31615"|"BabyZen"|"RB3A015632"|"BABYZEN-3760222211413-YO YO Color Pack Grigio dai 6 mesi"|"0000000002"|"0000000002"
"PO31615"|"2204217"|"20170127"|"20170127"|"PO31615"|"20170105"|"FO20170105_PO31615"|"BabyZen"|"RB3A015633"|"BABYZEN-3760222211444-YO YO Color Pack Taupe dai 6 mesi"|"0000000002"|"0000000002"
"PO31615"|"2204217"|"20170127"|"20170127"|"PO31615"|"20170105"|"FO20170105_PO31615"|"BabyZen"|"RB3A015634"|"BABYZEN-3760222211420-YO YO Color Pack Rosso dai 6 mesi"|"0000000001"|"0000000001"
"PO31650"|"2203217"|"20170127"|"20170127"|"PO31650"|"20170116"|"FO20170116_PO31650"|"Toby Tiger"|"RB3A014448"|"TOBY TIGER-DUCBRST-Salopette Marrone con Stelle Blu 6-12 mesi"|"0000000001"|"0000000001"
"PO31650"|"2203217"|"20170127"|"20170127"|"PO31650"|"20170116"|"FO20170116_PO31650"|"Toby Tiger"|"RB3A014463"|"TOBY TIGER-DUCDINO-Salopette Dinosauri 3-6 mesi"|"0000000001"|"0000000001"
"PO31650"|"2203217"|"20170127"|"20170127"|"PO31650"|"20170116"|"FO20170116_PO31650"|"Toby Tiger"|"RB3A014533"|"TOBY TIGER-SLAYDUCK-Pigiamino lungo a righe Anatroccoli 3-6 mesi"|"0000000001"|"0000000001"
"PO31650"|"2203217"|"20170127"|"20170127"|"PO31650"|"20170116"|"FO20170116_PO31650"|"Toby Tiger"|"RB3A014574"|"TOBY TIGER-PJTBLUEST-Pigiama Stelle 4-5 anni"|"0000000001"|"0000000001"
"PO31650"|"2203217"|"20170127"|"20170127"|"PO31650"|"20170116"|"FO20170116_PO31650"|"Toby Tiger"|"RB3A015067"|"TOBY TIGER-SLAMTREX-Tutina pigiamino T-REX 3-6 mesi"|"0000000001"|"0000000001"
"PO31650"|"2203217"|"20170127"|"20170127"|"PO31650"|"20170116"|"FO20170116_PO31650"|"Toby Tiger"|"RB3A015070"|"TOBY TIGER-SLABLION-Tutina pigiamino leoncino 3-6 mesi"|"0000000001"|"0000000001"
"PO31650"|"2203217"|"20170127"|"20170127"|"PO31650"|"20170116"|"FO20170116_PO31650"|"Toby Tiger"|"RB3A015071"|"TOBY TIGER-SLABLION-Tutina pigiamino leoncino 6-12 mesi"|"0000000001"|"0000000001"
"PO31650"|"2203217"|"20170127"|"20170127"|"PO31650"|"20170116"|"FO20170116_PO31650"|"Toby Tiger"|"RB3A015074"|"TOBY TIGER-SLABFOX-Tutina pigiamino volpe 6-12 mesi"|"0000000001"|"0000000001"
"PO31650"|"2203217"|"20170127"|"20170127"|"PO31650"|"20170116"|"FO20170116_PO31650"|"Toby Tiger"|"RB3A015077"|"TOBY TIGER-SLANROCKET-Tutina pigiamino razzo 6-12 mesi"|"0000000001"|"0000000001"
"PO31662"|"2200217"|"20170127"|"20170127"|"PO31662"|"20170119"|"FO20170119_PO31662"|"JULICA"|"RB3A009266"|"JULICA-100711-Poster della Crescita Giraffa Maschietti"|"0000000003"|"0000000003"
"PO31662"|"2200217"|"20170127"|"20170127"|"PO31662"|"20170119"|"FO20170119_PO31662"|"JULICA"|"RB3A009267"|"JULICA-100712-Poster della Crescita Giraffa Femminucce"|"0000000003"|"0000000003"
"PO31662"|"2200217"|"20170127"|"20170127"|"PO31662"|"20170119"|"FO20170119_PO31662"|"JULICA"|"RB3A009269"|"JULICA-101001-Astuccio Mangiapenne Tigre Tom"|"0000000001"|"0000000001"
"PO31662"|"2200217"|"20170127"|"20170127"|"PO31662"|"20170119"|"FO20170119_PO31662"|"JULICA"|"RB3A011271"|"JULICA-101007-Astuccio portapenne Menta"|"0000000001"|"0000000001"
"PO31667"|"2205217"|"20170127"|"20170127"|"PO31667"|"20170120"|"FO20170120_PO31667"|"KUK"|"RB3A009872"|"KUK-F115-25-Set 2 Copertine 70x60 Balena Blu"|"0000000002"|"0000000002"
"PO31667"|"2205217"|"20170127"|"20170127"|"PO31667"|"20170120"|"FO20170120_PO31667"|"KUK"|"RB3A010297"|"KUK-F115-37-Set 2 Copertine 70x60 Elefanti Rosa"|"0000000002"|"0000000002"
"PO31667"|"2205217"|"20170127"|"20170127"|"PO31667"|"20170120"|"FO20170120_PO31667"|"KUK"|"RB3A010298"|"KUK-F115-18-Set 2 Copertine 70x60 Volpe"|"0000000001"|"0000000001"
"PO31667"|"2205217"|"20170127"|"20170127"|""|"00000000"|"FO20170120_PO31667"|"KUK"|"RB3A010458"|"KUK-FF125-00-Pigiama con piedini Balena Blu 0-3 mesi"|"0000000000"|"0000000001"
"PO31667"|"2205217"|"20170127"|"20170127"|"PO31667"|"20170120"|"FO20170120_PO31667"|"KUK"|"RB3A010462"|"KUK-FF128-00-Pigiama con piedini Balena Rosa 3-6 mesi"|"0000000001"|"0000000001"
"PO31667"|"2205217"|"20170127"|"20170127"|"PO31667"|"20170120"|"FO20170120_PO31667"|"KUK"|"RB3A010546"|"KUK-FS328-00-Body Manica corta Balena Rosa 3-6 mesi"|"0000000001"|"0000000001"
"PO31667"|"2205217"|"20170127"|"20170127"|"PO31667"|"20170120"|"FO20170120_PO31667"|"KUK"|"RB3A010552"|"KUK-FS309-00-Body Manica corta Renna Grigio 3-6 mesi"|"0000000001"|"0000000001"
"PO31667"|"2205217"|"20170127"|"20170127"|"PO31667"|"20170120"|"FO20170120_PO31667"|"KUK"|"RB3A010555"|"KUK-FS374-00-Body Manica corta Foglie Grigio 3-6 mesi"|"0000000001"|"0000000001"
"PO31674"|"2202217"|"20170127"|"20170127"|"PO31674"|"20170123"|"FO20170123_PO31674"|"limobasics"|"RB2000JU-BI-M1-CO"|"LIMOBASICS-09519R 56 bln-Body Kimono a Manica Lunga"|"0000000001"|"0000000001"
"PO31674"|"2202217"|"20170127"|"20170127"|"PO31674"|"20170123"|"FO20170123_PO31674"|"limobasics"|"RB2000JW-DE-M-CO"|"LIMOBASICS-09510R 50 den-Pantalone con Piedino"|"0000000001"|"0000000001"
"PO31674"|"2202217"|"20170127"|"20170127"|"PO31674"|"20170123"|"FO20170123_PO31674"|"limobasics"|"RB2000K7-DE-M1-CO"|"LIMOBASICS-70502R 56 den-Baby Pack"|"0000000001"|"0000000001"
"PO31674"|"2202217"|"20170127"|"20170127"|"PO31674"|"20170123"|"FO20170123_PO31674"|"limobasics"|"RB2000X5-DE-4_8M-CO"|"LIMOBASICS-19522R 62-68 den-Body Manica Corta Scollo Tondo"|"0000000001"|"0000000001"
"PO31674"|"2202217"|"20170127"|"20170127"|"PO31674"|"20170123"|"FO20170123_PO31674"|"limobasics"|"RB2000X5-GI-4_8M-CO"|"LIMOBASICS-19522R 62-68 zen-Body Manica Corta Scollo Tondo"|"0000000001"|"0000000001"
"PO31674"|"2202217"|"20170127"|"20170127"|"PO31674"|"20170123"|"FO20170123_PO31674"|"limobasics"|"RB3A007849"|"LIMOBASICS-09509R 62-68-Culotte blu navy AZM"|"0000000001"|"0000000001"
"PO31674"|"2202217"|"20170127"|"20170127"|"PO31674"|"20170123"|"FO20170123_PO31674"|"limobasics"|"RB3A007852"|"LIMOBASICS-09509R 62-68-Culotte denim DEN"|"0000000001"|"0000000001"
"PO31674"|"2202217"|"20170127"|"20170127"|"PO31674"|"20170123"|"FO20170123_PO31674"|"limobasics"|"RB3A007885"|"LIMOBASICS-09509R 62-68-Culotte grigio chiaro GRI"|"0000000001"|"0000000001"
"PO31674"|"2202217"|"20170127"|"20170127"|"PO31674"|"20170123"|"FO20170123_PO31674"|"limobasics"|"RB3A008022"|"LIMOBASICS-22525R 50-56-Tutina manica corta scollo tondo grigio chiaro GRI"|"0000000001"|"0000000001"
"PO31674"|"2202217"|"20170127"|"20170127"|"PO31674"|"20170123"|"FO20170123_PO31674"|"limobasics"|"RB3A011142"|"LIMOBASICS-09509RSDE50-56-Culotte a righe Denim 50 56 cm"|"0000000001"|"0000000001"
"PO31674"|"2202217"|"20170127"|"20170127"|"PO31674"|"20170123"|"FO20170123_PO31674"|"limobasics"|"RB3A011159"|"LIMOBASICS-09510RSDE56-Pantaloni con piedini a strice Denim 56 cm"|"0000000001"|"0000000001"
"PO31674"|"2202217"|"20170127"|"20170127"|"PO31674"|"20170123"|"FO20170123_PO31674"|"limobasics"|"RB3A011188"|"LIMOBASICS-09523RSDE56-Cardigan Kimono a strisce Denim 56 cm"|"0000000001"|"0000000001"
"PO31678"|"2201217"|"20170127"|"20170127"|""|"00000000"|"FO20170123_PO31678"|"ChildHome"|"RB3A009978"|"CHILDHOME-CCFPT-Cestone portagiochi Casetta Grigio e Turchese"|"0000000000"|"0000000001"
"PO31678"|"2201217"|"20170127"|"20170127"|"PO31678"|"20170123"|"FO20170123_PO31678"|"ChildHome"|"RB3A009981"|"CHILDHOME-CCCB60GS-Cesto Contenitore Stella Grigio 60x32x32"|"0000000004"|"0000000004"
"PO31678"|"2201217"|"20170127"|"20170127"|"PO31678"|"20170123"|"FO20170123_PO31678"|"ChildHome"|"RB3A009982"|"CHILDHOME-CCCB60DB-Cesto Contenitore Stella Blu scuro 60x32x32"|"0000000001"|"0000000001"
"PO31678"|"2201217"|"20170127"|"20170127"|"PO31678"|"20170123"|"FO20170123_PO31678"|"ChildHome"|"RB3A009998"|"CHILDHOME-CCFSBMB-Scatola Portaoggetti Nuvola Grigio e Menta 32x32x29"|"0000000001"|"0000000001"
"PO31678"|"2201217"|"20170127"|"20170127"|"PO31678"|"20170123"|"FO20170123_PO31678"|"ChildHome"|"RB3A010005"|"CHILDHOME-CCFTBRL-Borsone Portagiochi Round Grigia e Lime"|"0000000002"|"0000000002"
"PO31678"|"2201217"|"20170127"|"20170127"|"PO31678"|"20170123"|"FO20170123_PO31678"|"ChildHome"|"RB3A010006"|"CHILDHOME-CCFTBRMB-Borsone Portagiochi Round Grigia e Menta"|"0000000001"|"0000000001"
"PO31678"|"2201217"|"20170127"|"20170127"|"PO31678"|"20170123"|"FO20170123_PO31678"|"ChildHome"|"RB3A010037"|"CHILDHOME-RCKW-Sedia a Dondolo per Bambini Bianca"|"0000000001"|"0000000001"
"PO31678"|"2201217"|"20170127"|"20170127"|"PO31678"|"20170123"|"FO20170123_PO31678"|"ChildHome"|"RB3A010071"|"CHILDHOME-CHEVOSCPMG-Cuscino per Seggiolone Evolu 2 Grigio Chiaro"|"0000000001"|"0000000001"
"PO31678"|"2201217"|"20170127"|"20170127"|"PO31678"|"20170123"|"FO20170123_PO31678"|"ChildHome"|"RB3A010167"|"CHILDHOME-CHBBHF-Supporto per Bagnetto Bianco e Rosa"|"0000000001"|"0000000001"
"PO31678"|"2201217"|"20170127"|"20170127"|"PO31678"|"20170123"|"FO20170123_PO31678"|"ChildHome"|"RB3A010836"|"CHILDHOME-CHSBF-Set Pappa Fucsia e Bianco"|"0000000003"|"0000000003"
"PO31678"|"2201217"|"20170127"|"20170127"|"PO31678"|"20170123"|"FO20170123_PO31678"|"ChildHome"|"RB3A010842"|"CHILDHOME-CHWPF-Set Pappa con piatto riscaldato Fucsia e Bianco"|"0000000001"|"0000000001"
"PO31678"|"2201217"|"20170127"|"20170127"|"PO31678"|"20170123"|"FO20170123_PO31678"|"ChildHome"|"RB3A010921"|"CHILDHOME-CWNNBDG-Borsa Fasciatoio in Neoprene Grigio Scuro"|"0000000001"|"0000000001"
"RESO ORD. 21963"|"2197217"|"20170127"|"20170127"|""|"00000000"|"00002"|"ROCKETBABY"|"RB3A016206"|"NOPPIES-67336C295-Jeans Baby 74cm"|"0000000000"|"0000000001"
"RESO ORD. 22002"|"2196217"|"20170127"|"20170127"|""|"00000000"|"00002"|"ROCKETBABY"|"RB3A017371"|"NOPPIES-67299C166-Set Regalo Baby Outfit Basic Blu Stella 56 cm"|"0000000000"|"0000000001"
"RESO ORD. 22289"|"2189217"|"20170127"|"20170127"|""|"00000000"|"00002"|"ROCKETBABY"|"RB3A014985"|"AQUASCALE-84231090-Vaschetta digitale con bilancia incorporata"|"0000000000"|"0000000001"
"RESO ORD. 22512"|"2199217"|"20170127"|"20170127"|""|"00000000"|"00002"|"ROCKETBABY"|"RB2000PH"|"ELODIE DETAILS-103310-Copertina Bamboo a Mongolfiere Moon Balloon"|"0000000000"|"0000000001"
"RESO ORD. 22512"|"2199217"|"20170127"|"20170127"|""|"00000000"|"00002"|"ROCKETBABY"|"RB3A013574"|"BLADEeROSE-5060257465781-Leggings Crazy Cat 2-3y"|"0000000000"|"0000000001"
"RESO ORD. 22613"|"2192217"|"20170127"|"20170127"|""|"00000000"|"00002"|"ROCKETBABY"|"RB3A014985"|"AQUASCALE-84231090-Vaschetta digitale con bilancia incorporata"|"0000000000"|"0000000001"
"RESO ORD. 22971"|"2184217"|"20170127"|"20170127"|""|"00000000"|"00002"|"ROCKETBABY"|"RB3A014985"|"AQUASCALE-84231090-Vaschetta digitale con bilancia incorporata"|"0000000000"|"0000000001"
"RESO ORD. 23059"|"2195217"|"20170127"|"20170127"|""|"00000000"|"00002"|"ROCKETBABY"|"RB3A015734"|"IIAMO-601-Biberon autoriscaldante da casa bianco e rosa"|"0000000000"|"0000000001"
"RESO ORD. 23060"|"2194217"|"20170127"|"20170127"|""|"00000000"|"00002"|"ROCKETBABY"|"RB3A015742"|"IIAMO-703-Cartucce termiche per biberon autoriscaldante"|"0000000000"|"0000000001"
"RESO ORD. 23082"|"2193217"|"20170127"|"20170127"|""|"00000000"|"00002"|"ROCKETBABY"|"RB3A015741"|"IIAMO-108-Biberon autoriscaldante da viaggio bianco e blu"|"0000000000"|"0000000001"
"RESO ORD. 23082"|"2193217"|"20170127"|"20170127"|""|"00000000"|"00002"|"ROCKETBABY"|"RB3A015742"|"IIAMO-703-Cartucce termiche per biberon autoriscaldante"|"0000000000"|"0000000002"
"RESO ORD. 23245"|"2187217"|"20170127"|"20170127"|""|"00000000"|"00002"|"ROCKETBABY"|"RB20012S"|"Duux-DUBP01B-Proiettore per Bambini blu"|"0000000000"|"0000000002"
"RESO ORD. 23333"|"2185217"|"20170127"|"20170127"|""|"00000000"|"00002"|"ROCKETBABY"|"RB3A015741"|"IIAMO-108-Biberon autoriscaldante da viaggio bianco e blu"|"0000000000"|"0000000001"
"RESO ORD. 23359"|"2191217"|"20170127"|"20170127"|""|"00000000"|"00002"|"ROCKETBABY"|"RB3A017387"|"KAISER-6570826-Sacco passeggino khaki 105x48"|"0000000000"|"0000000001"
"RESO ORD. 23456"|"2198217"|"20170127"|"20170127"|""|"00000000"|"00002"|"ROCKETBABY"|"RB3A014030"|"NIKE-454478-PICO 4 (TDV) ROSA 9C-EU26"|"0000000000"|"0000000001"
"RESO ORD. 23468"|"2183217"|"20170127"|"20170127"|""|"00000000"|"00002"|"ROCKETBABY"|"RB3A015742"|"IIAMO-703-Cartucce termiche per biberon autoriscaldante"|"0000000000"|"0000000001"
"RESO ORD. 23571"|"2186217"|"20170127"|"20170127"|""|"00000000"|"00002"|"ROCKETBABY"|"RB3A015741"|"IIAMO-108-Biberon autoriscaldante da viaggio bianco e blu"|"0000000000"|"0000000001"
"RESO ORD. 23571"|"2186217"|"20170127"|"20170127"|""|"00000000"|"00002"|"ROCKETBABY"|"RB3A015742"|"IIAMO-703-Cartucce termiche per biberon autoriscaldante"|"0000000000"|"0000000002"
"RESO ORD. 23722"|"2188217"|"20170127"|"20170127"|""|"00000000"|"00002"|"ROCKETBABY"|"RB20012Q"|"Duux-DUBP01-Proiettore per Bambini Bianco"|"0000000000"|"0000000001"
"RESO ORD. 23775"|"2190217"|"20170127"|"20170127"|""|"00000000"|"00002"|"ROCKETBABY"|"RB3A017387"|"KAISER-6570826-Sacco passeggino khaki 105x48"|"0000000000"|"0000000001"
