"RicNumero"|"RicProtocollo"|"RicData"|"RicDataConsegna"|"RicOrdineNumero"|"RicOrdineData"|"RicCodiceFornitore"|"RicRagSocFornitore"|"RicAnaArtCodice"|"RicAnaArtDescrizione"|"RicQuantitaOrdinata"|"RicQuantitaRicevuta"
"PO32308"|"3100217"|"20170601"|"20170601"|"PO32308"|"20170522"|"FO20170522_PO32308"|"Suavinex"|"RB3A019709"|"SUAVINEX-QS005DV02-DUCCIO STERILIZZACIUCCIO VERDE"|"0000000010"|"0000000010"
"RESO ORD. 26204"|"3113217"|"20170601"|"20170601"|""|"00000000"|"00002"|"ROCKETBABY"|"RB3A018664"|"LOLLIPOPS AND MORE-2952349927600-Lollipops and More Pacifier Bonbons Clip Violet Red"|"0000000000"|"0000000001"
"RESO ORD. 27367"|"3110217"|"20170601"|"20170601"|""|"00000000"|"00002"|"ROCKETBABY"|"RB3A019448"|"FUNKY BOX-FB01-Porta Salviettine Umidificate Funky Box Azzurro con Stella Bianca"|"0000000000"|"0000000001"
"RESO ORD. 27450"|"3111217"|"20170601"|"20170601"|""|"00000000"|"00002"|"ROCKETBABY"|"RB3A019456"|"FUNKY BOX-FBTG06-Porta Salviettine Umidificate da Viaggio Funky Box Rosa con Cuore Bianco"|"0000000000"|"0000000001"
"RESO ORD. 27547"|"3103217"|"20170601"|"20170601"|""|"00000000"|"00002"|"ROCKETBABY"|"RB3A009314"|"ROCKETBABY-RBP15100303-Cesto per Passeggino Riccio"|"0000000000"|"0000000001"
"RESO ORD. 27547"|"3103217"|"20170601"|"20170601"|""|"00000000"|"00002"|"ROCKETBABY"|"RB3A019452"|"FUNKY BOX-FB13-Porta Salviettine Umidificate Funky Box Grigio con Stella Bianca"|"0000000000"|"0000000001"
"RESO ORD. 27547"|"3103217"|"20170601"|"20170601"|""|"00000000"|"00002"|"ROCKETBABY"|"RB3A019458"|"FUNKY BOX-FBTG13-Porta Salviettine Umidificate da Viaggio Funky Box Grigio Chiaro con Stella Bianca"|"0000000000"|"0000000001"
"RESO ORD. 27737"|"3108217"|"20170601"|"20170601"|""|"00000000"|"00002"|"ROCKETBABY"|"RB3A012347"|"CUPCAKE BABIES-VDBB05-Cappello Anti Schiuma Blu"|"0000000000"|"0000000001"
"RESO ORD. 27737"|"3108217"|"20170601"|"20170601"|""|"00000000"|"00002"|"ROCKETBABY"|"RB3A019490"|"MAKE MY DAY-BB111-Bavaglia in silicone - Dog"|"0000000000"|"0000000001"
"RESO ORD. 27780"|"3114217"|"20170601"|"20170601"|""|"00000000"|"00002"|"ROCKETBABY"|"RB3A019458"|"FUNKY BOX-FBTG13-Porta Salviettine Umidificate da Viaggio Funky Box Grigio Chiaro con Stella Bianca"|"0000000000"|"0000000001"
"RESO ORD. 27820"|"3116217"|"20170601"|"20170601"|""|"00000000"|"00002"|"ROCKETBABY"|"RB3A017516"|"LILIPUTI-2006002020150-Marsupio Rainbow Line Skully"|"0000000000"|"0000000001"
"RESO ORD. 27972"|"3109217"|"20170601"|"20170601"|""|"00000000"|"00002"|"ROCKETBABY"|"RB3A009313"|"ROCKETBABY-RBP15100302-Cesto per Passeggino Elefante Verde"|"0000000000"|"0000000001"
"RESO ORD. 27984"|"3121217"|"20170601"|"20170601"|""|"00000000"|"00002"|"ROCKETBABY"|"RB3A019595"|"BABY ELEPHANT EARS-1026-Baby Elephant Ears Cuscino Ergonomico con Macchinine"|"0000000000"|"0000000001"
"RESO ORD. 28161"|"3138217"|"20170601"|"20170601"|""|"00000000"|"00002"|"ROCKETBABY"|"RB3A008322"|"COQ EN PATE-L13EACCBOBMBGIRCappellino Giraffa M (2-3 anni)"|"0000000000"|"0000000001"
"RESO ORD. 28161"|"3138217"|"20170601"|"20170601"|""|"00000000"|"00002"|"ROCKETBABY"|"RB3A008918"|"TYRRELL KATZ-Snack Boxes Giungla"|"0000000000"|"0000000001"
"RESO ORD. 28161"|"3138217"|"20170601"|"20170601"|""|"00000000"|"00002"|"ROCKETBABY"|"RB3A008919"|"TYRRELL KATZ-Snack Boxes elefanti"|"0000000000"|"0000000001"
"RESO ORD. 28161"|"3138217"|"20170601"|"20170601"|""|"00000000"|"00002"|"ROCKETBABY"|"RB3A008938"|"TYRRELL KATZ-Ciotola Giungla"|"0000000000"|"0000000001"
"RESO ORD. 28161"|"3138217"|"20170601"|"20170601"|""|"00000000"|"00002"|"ROCKETBABY"|"RB3A008939"|"TYRRELL KATZ-Ciotola elefanti"|"0000000000"|"0000000001"
"RESO ORD. 28161"|"3138217"|"20170601"|"20170601"|""|"00000000"|"00002"|"ROCKETBABY"|"RB3A008947"|"TYRRELL KATZ-Piatto Giungla"|"0000000000"|"0000000001"
"RESO ORD. 28161"|"3138217"|"20170601"|"20170601"|""|"00000000"|"00002"|"ROCKETBABY"|"RB3A008948"|"TYRRELL KATZ-Piatto elefanti"|"0000000000"|"0000000001"
"RESO ORD. 28161"|"3138217"|"20170601"|"20170601"|""|"00000000"|"00002"|"ROCKETBABY"|"RB3A008979"|"TYRRELL KATZ-Posate Giungla"|"0000000000"|"0000000001"
"RESO ORD. 28161"|"3138217"|"20170601"|"20170601"|""|"00000000"|"00002"|"ROCKETBABY"|"RB3A008980"|"TYRRELL KATZ-Posate elefanti"|"0000000000"|"0000000001"
"RESO ORD. 28161"|"3138217"|"20170601"|"20170601"|""|"00000000"|"00002"|"ROCKETBABY"|"RB3A008994"|"TYRRELL KATZ-Bavaglino Giungla"|"0000000000"|"0000000001"
"RESO ORD. 28161"|"3138217"|"20170601"|"20170601"|""|"00000000"|"00002"|"ROCKETBABY"|"RB3A008995"|"TYRRELL KATZ-Bavaglino elefanti"|"0000000000"|"0000000001"
"RESO ORD. 28161"|"3138217"|"20170601"|"20170601"|""|"00000000"|"00002"|"ROCKETBABY"|"RB3A011095"|"COQ EN PATE-L16ACCBOBMBLEM-Cappellino Lemure S"|"0000000000"|"0000000001"
"RESO ORD. 28161"|"3138217"|"20170601"|"20170601"|""|"00000000"|"00002"|"ROCKETBABY"|"RB3A011099"|"COQ EN PATE-L16ACCBOBMBELE-Cappellino Elefante M"|"0000000000"|"0000000001"
"RESO ORD. 28161"|"3138217"|"20170601"|"20170601"|""|"00000000"|"00002"|"ROCKETBABY"|"RB3A013436"|"ELODIE DETAILS-103616-Borsa Fasciatoio Forest Flora"|"0000000000"|"0000000001"
"RESO ORD. 28161"|"3138217"|"20170601"|"20170601"|""|"00000000"|"00002"|"ROCKETBABY"|"RB3A019652"|"FUNKIT WORLD-SBU-05-Funkit World Secchiello da Spiaggia in Silicone Rosa"|"0000000000"|"0000000001"
"RESO ORD. 28161"|"3138217"|"20170601"|"20170601"|""|"00000000"|"00002"|"ROCKETBABY"|"RB3A019654"|"FUNKIT WORLD-SMO-41-Funkit World Formine per la Sabbia in Silicone Blu"|"0000000000"|"0000000001"
"RESO ORD. 28161"|"3138217"|"20170601"|"20170601"|""|"00000000"|"00002"|"ROCKETBABY"|"RB3A019658"|"FUNKIT WORLD-SSP-55-Funkit World Paletta per la Sabbia in Silicone Rosa"|"0000000000"|"0000000001"
"RESO ORD. 28169"|"3133217"|"20170601"|"20170601"|""|"00000000"|"00002"|"ROCKETBABY"|"RB3A008309"|"COQ EN PATE-L15ACCBOBMBPAN-Cappellino Panda S (6-18 mesi)"|"0000000000"|"0000000001"
"RESO ORD. 28185"|"3130217"|"20170601"|"20170601"|""|"00000000"|"00002"|"ROCKETBABY"|"RB3A019650"|"FUNKIT WORLD-SBU-01-Funkit World Secchiello da Spiaggia in Silicone Blu"|"0000000000"|"0000000001"
"RESO ORD. 28185"|"3130217"|"20170601"|"20170601"|""|"00000000"|"00002"|"ROCKETBABY"|"RB3A019652"|"FUNKIT WORLD-SBU-05-Funkit World Secchiello da Spiaggia in Silicone Rosa"|"0000000000"|"0000000001"
"RESO ORD. 28185"|"3130217"|"20170601"|"20170601"|""|"00000000"|"00002"|"ROCKETBABY"|"RB3A019655"|"FUNKIT WORLD-SSP-51-Funkit World Paletta per la Sabbia in Silicone Blu"|"0000000000"|"0000000002"
"RESO ORD. 28185"|"3130217"|"20170601"|"20170601"|""|"00000000"|"00002"|"ROCKETBABY"|"RB3A019658"|"FUNKIT WORLD-SSP-55-Funkit World Paletta per la Sabbia in Silicone Rosa"|"0000000000"|"0000000001"
"RESO ORD. 28185"|"3130217"|"20170601"|"20170601"|""|"00000000"|"00002"|"ROCKETBABY"|"RB3A019659"|"FUNKIT WORLD-SBB-61-Funkit World Borsa da Spiaggia in Silicone Rosa"|"0000000000"|"0000000001"
"RESO ORD. 28207"|"3101217"|"20170601"|"20170601"|""|"00000000"|"00002"|"ROCKETBABY"|"RB3A018438"|"SUPERGA-S003KU0 _J29-Sneaker Baby Space Blue-19"|"0000000000"|"0000000001"
"RESO ORD. 28209"|"3102217"|"20170601"|"20170601"|""|"00000000"|"00002"|"ROCKETBABY"|"RB3A011822"|"SUPERGA-S001FJ0 C88-Sneaker Baby Superga Island Green 23"|"0000000000"|"0000000001"
"RESO ORD. 28237"|"3119217"|"20170601"|"20170601"|""|"00000000"|"00002"|"ROCKETBABY"|"RB3A011877"|"SUPERGA-S001CM0 T33-Sneaker Baby Superga Pink Paradise 20"|"0000000000"|"0000000001"
"RESO ORD. 28245"|"3105217"|"20170601"|"20170601"|""|"00000000"|"00002"|"ROCKETBABY"|"RB3A013154"|"BAMBOOM-104-000-059-CAPPELLINO BIMBO baby hat AZZURRO E GRIGIO-TAGLIA-3-6M"|"0000000000"|"0000000001"
"RESO ORD. 28251"|"3118217"|"20170601"|"20170601"|""|"00000000"|"00002"|"ROCKETBABY"|"RB3A018443"|"SUPERGA-S003KU0 _J29-Sneaker Baby Space Blue-24"|"0000000000"|"0000000001"
"RESO ORD. 28281"|"3122217"|"20170601"|"20170601"|""|"00000000"|"00002"|"ROCKETBABY"|"RB3A009817"|"FCTRY-GLSTA21-Occhiali da Sole Baby Neri 0-2 anni"|"0000000000"|"0000000001"
"RESO ORD. 28281"|"3122217"|"20170601"|"20170601"|""|"00000000"|"00002"|"ROCKETBABY"|"RB3A015769"|"FCTRY-GLSTA29-Occhiali da sole Polarizzati Baby Tartaruga 0-2 anni"|"0000000000"|"0000000001"
"RESO ORD. 28429"|"3131217"|"20170601"|"20170601"|""|"00000000"|"00002"|"ROCKETBABY"|"RB3A011879"|"SUPERGA-S001CM0 T33-Sneaker Baby Superga Pink Paradise 22"|"0000000000"|"0000000001"
"RESO ORD. 28446"|"3120217"|"20170601"|"20170601"|""|"00000000"|"00002"|"ROCKETBABY"|"RB3A019670"|"BUBBLEGUM STUFF-13591-Bubblegum Stuff Rocket Baby Bottle"|"0000000000"|"0000000001"
"RESO ORD. 28483"|"3126217"|"20170601"|"20170601"|""|"00000000"|"00002"|"ROCKETBABY"|"RB3A017394"|"LITECUP-5060168240040-Bicchierone Che Si Illumina Viola"|"0000000000"|"0000000001"
"RESO ORD. 28483"|"3126217"|"20170601"|"20170601"|""|"00000000"|"00002"|"ROCKETBABY"|"RB3A017402"|"LITECUP-5060168240828-Bicchierone Che Si Illumina Azzurro"|"0000000000"|"0000000001"
"RESO ORD. 28483"|"3126217"|"20170601"|"20170601"|""|"00000000"|"00002"|"ROCKETBABY"|"RB3A019671"|"BUBBLEGUM STUFF-14052-Bubblegum Stuff Babychino Sippy Cup"|"0000000000"|"0000000002"
"RESO ORD. 28613"|"3132217"|"20170601"|"20170601"|""|"00000000"|"00002"|"ROCKETBABY"|"RB3A014985"|"AQUASCALE-84231090-Vaschetta digitale con bilancia incorporata"|"0000000000"|"0000000001"
"RESO ORD. 28633"|"3129217"|"20170601"|"20170601"|""|"00000000"|"00002"|"ROCKETBABY"|"RB3A019520"|"DOODOO-121-BabiAge DooDoo 0121 coniglio a pois beige"|"0000000000"|"0000000001"
"RESO ORD. 28652"|"3117217"|"20170601"|"20170601"|""|"00000000"|"00002"|"ROCKETBABY"|"RB3A016476"|"ROCKETBABY-RBP16361-Cesto Passeggino Coniglio"|"0000000000"|"0000000001"
"RESO ORD. 28676"|"3107217"|"20170601"|"20170601"|""|"00000000"|"00002"|"ROCKETBABY"|"RB3A011243"|"SUPERGA-S001FJ0 G88 19-Sneaker Bambino/a Blu Intenso 19"|"0000000000"|"0000000001"
"RESO ORD. 28704"|"3128217"|"20170601"|"20170601"|""|"00000000"|"00002"|"ROCKETBABY"|"RB3A013435"|"ELODIE DETAILS-103615-Borsa Fasciatoio Woodland Green"|"0000000000"|"0000000001"
"RESO ORD. 28717"|"3106217"|"20170601"|"20170601"|""|"00000000"|"00002"|"ROCKETBABY"|"RB3A013367"|"BAMBOOM-104-043-004-TWIN SET 1M PURE Wrap-shirtetrousers in velvet soft jersey ROSA-TAGLIA-1M"|"0000000000"|"0000000001"
"RESO ORD. 28720"|"3115217"|"20170601"|"20170601"|""|"00000000"|"00002"|"ROCKETBABY"|"RB3A012801"|"TELLKIDDO-52-Sacco Portaoggetti Canvas Toys"|"0000000000"|"0000000001"
"RESO ORD. 28720"|"3115217"|"20170601"|"20170601"|""|"00000000"|"00002"|"ROCKETBABY"|"RB3A012804"|"TELLKIDDO-51-Sacco Portaoggetti Canvas Sleeping Bear"|"0000000000"|"0000000001"
"RESO ORD. 28807"|"3104217"|"20170601"|"20170601"|""|"00000000"|"00002"|"ROCKETBABY"|"RB3A013437"|"ELODIE DETAILS-103617-Borsa Fasciatoio DOT"|"0000000000"|"0000000001"
"RESO ORD. 28943"|"3137217"|"20170601"|"20170601"|""|"00000000"|"00002"|"ROCKETBABY"|"RB3A017492"|"BOON-B10123A-Cucchiaio Dispenser Per La Pappa Verde"|"0000000000"|"0000000001"
"RESO ORD. 28956"|"3127217"|"20170601"|"20170601"|""|"00000000"|"00002"|"ROCKETBABY"|"RB3A014985"|"AQUASCALE-84231090-Vaschetta digitale con bilancia incorporata"|"0000000000"|"0000000001"
"RESO ORD. 28962"|"3139217"|"20170601"|"20170601"|""|"00000000"|"00002"|"ROCKETBABY"|"RB3A016476"|"ROCKETBABY-RBP16361-Cesto Passeggino Coniglio"|"0000000000"|"0000000001"
"RESO ORD. 29004"|"3135217"|"20170601"|"20170601"|""|"00000000"|"00002"|"ROCKETBABY"|"RB3A016475"|"ROCKETBABY-RBP16360-Cesto Passeggino Narvalo"|"0000000000"|"0000000001"
"RESO ORD. 29033"|"3123217"|"20170601"|"20170601"|""|"00000000"|"00002"|"ROCKETBABY"|"RB3A014985"|"AQUASCALE-84231090-Vaschetta digitale con bilancia incorporata"|"0000000000"|"0000000001"
"RESO ORD. 29271"|"3112217"|"20170601"|"20170601"|""|"00000000"|"00002"|"ROCKETBABY"|"RB2000PK"|"ELODIE DETAILS-103312-Copertina Bamboo Rosa con Piume Feather Love"|"0000000000"|"0000000001"
"RESO ORD. 29401"|"3134217"|"20170601"|"20170601"|""|"00000000"|"00002"|"ROCKETBABY"|"RB3A019633"|"I PLAY-721054-642-Iplay Costumino Pannolino Contenitivo Mix'n Match Royal Viking Sea-18 Mesi"|"0000000000"|"0000000001"
"RESO ORD. 29408"|"3124217"|"20170601"|"20170601"|""|"00000000"|"00002"|"ROCKETBABY"|"RB3A009314"|"ROCKETBABY-RBP15100303-Cesto per Passeggino Riccio"|"0000000000"|"0000000001"
"RESO ORD. 29468"|"3125217"|"20170601"|"20170601"|""|"00000000"|"00002"|"ROCKETBABY"|"RB3A014984"|"MINILAND-89143-Baby kit blue"|"0000000000"|"0000000001"
"RESO ORD. 29477"|"3136217"|"20170601"|"20170601"|""|"00000000"|"00002"|"ROCKETBABY"|"RB3A019670"|"BUBBLEGUM STUFF-13591-Bubblegum Stuff Rocket Baby Bottle"|"0000000000"|"0000000001"
"RESO ORD. AJ001"|"3140217"|"20170601"|"20170601"|""|"00000000"|"00002"|"ROCKETBABY"|"RB3A014985"|"AQUASCALE-84231090-Vaschetta digitale con bilancia incorporata"|"0000000000"|"0000000001"
