"RicNumero"|"RicProtocollo"|"RicData"|"RicDataConsegna"|"RicOrdineNumero"|"RicOrdineData"|"RicCodiceFornitore"|"RicRagSocFornitore"|"RicAnaArtCodice"|"RicAnaArtDescrizione"|"RicQuantitaOrdinata"|"RicQuantitaRicevuta"
"PO32500"|"3511217"|"20170711"|"20170711"|"PO32500"|"20170620"|"FO20170620_PO32500"|"Bamboom"|"RB3A013136"|"BAMBOOM-104-000-119-BODY Sleeveless (front opening) BIANCO-TAGLIA-3M"|"0000000001"|"0000000001"
"PO32552"|"3509217"|"20170711"|"20170711"|"PO32552"|"20170628"|"FO20170628_PO32552"|"Miniland"|"RB3A014973"|"MINILAND-89017-WARMY"|"0000000001"|"0000000001"
"PO32552"|"3509217"|"20170711"|"20170711"|"PO32552"|"20170628"|"FO20170628_PO32552"|"Miniland"|"RB3A014976"|"MINILAND-89146-CHEFY 5"|"0000000001"|"0000000001"
"PO32552"|"3509217"|"20170711"|"20170711"|"PO32552"|"20170628"|"FO20170628_PO32552"|"Miniland"|"RB3A014980"|"MINILAND-89158-EMYSCALE"|"0000000001"|"0000000001"
"PO32552"|"3509217"|"20170711"|"20170711"|"PO32552"|"20170628"|"FO20170628_PO32552"|"Miniland"|"RB3A020987"|"MINILAND-89152-Thermos per Pappe e Bevande con Contenitori Ermetici Blu"|"0000000002"|"0000000002"
"PO32552"|"3509217"|"20170711"|"20170711"|"PO32552"|"20170628"|"FO20170628_PO32552"|"Miniland"|"RB3A020988"|"MINILAND-89153-Thermos per Pappe e Bevande con Contenitori Ermetici Rosa"|"0000000002"|"0000000002"
"PO32552"|"3509217"|"20170711"|"20170711"|"PO32552"|"20170628"|"FO20170628_PO32552"|"Miniland"|"RB3A020989"|"MINILAND-89072-Borsa isotermica con 2 Contenitori Ermetici Blu"|"0000000002"|"0000000002"
"PO32552"|"3509217"|"20170711"|"20170711"|"PO32552"|"20170628"|"FO20170628_PO32552"|"Miniland"|"RB3A020990"|"MINILAND-89139-Borsa isotermica con 2 Contenitori Ermetici Rosa"|"0000000002"|"0000000002"
"PO32552"|"3509217"|"20170711"|"20170711"|"PO32552"|"20170628"|"FO20170628_PO32552"|"Miniland"|"RB3A020991"|"MINILAND-89141-Borsa isotermica con 2 Contenitori Ermetici Graduati Blu"|"0000000002"|"0000000002"
"PO32552"|"3509217"|"20170711"|"20170711"|"PO32552"|"20170628"|"FO20170628_PO32552"|"Miniland"|"RB3A020992"|"MINILAND-89071-Borsa isotermica con 2 Contenitori Ermetici Graduati Blu"|"0000000002"|"0000000001"
"PO32552"|"3509217"|"20170711"|"20170711"|"PO32552"|"20170628"|"FO20170628_PO32552"|"Miniland"|"RB3A020994"|"MINILAND-89162-Cuscino da Allattamento Elefantino"|"0000000002"|"0000000002"
"PO32585"|"3510217"|"20170711"|"20170711"|"PO32585"|"20170704"|"FO20170704_PO32585"|"Bamboom"|"RB3A013056"|"BAMBOOM-104-000-003-AIR 'N GO - Stroller mattress GRIGIO-0"|"0000000001"|"0000000001"
"PO32585"|"3510217"|"20170711"|"20170711"|"PO32585"|"20170704"|"FO20170704_PO32585"|"Bamboom"|"RB3A013131"|"BAMBOOM-104-000-117-BODY Short sleeves (front opening) BIANCO-TAGLIA-3M"|"0000000004"|"0000000004"
"PO32585"|"3510217"|"20170711"|"20170711"|"PO32585"|"20170704"|"FO20170704_PO32585"|"Bamboom"|"RB3A013136"|"BAMBOOM-104-000-119-BODY Sleeveless (front opening) BIANCO-TAGLIA-3M"|"0000000002"|"0000000002"
"PO32587"|"3505217"|"20170711"|"20170711"|"PO32587"|"20170704"|"FO20170704_PO32587"|"I Play"|"RB3A021016"|"I PLAY-IP-721200-678-47-Costumino Assorbente Mix'n Match Aqua-2-3 Anni"|"0000000001"|"0000000001"
"PO32587"|"3505217"|"20170711"|"20170711"|"PO32587"|"20170704"|"FO20170704_PO32587"|"I Play"|"RB3A021021"|"I PLAY-IP-721200-608-45-Costumino Assorbente Mix'n Match Blu-18-24 Mesi"|"0000000001"|"0000000001"
"PO32587"|"3505217"|"20170711"|"20170711"|"PO32587"|"20170704"|"FO20170704_PO32587"|"I Play"|"RB3A021030"|"I PLAY-IP-721159-639-43-Costumino Assorbente Mix'n Match Tartarughe-6- 12 Mesi"|"0000000001"|"0000000001"
"PO32587"|"3505217"|"20170711"|"20170711"|"PO32587"|"20170704"|"FO20170704_PO32587"|"I Play"|"RB3A021032"|"I PLAY-IP-721159-639-45-Costumino Assorbente Mix'n Match Tartarughe-18-24 Mesi"|"0000000002"|"0000000002"
"PO32587"|"3505217"|"20170711"|"20170711"|"PO32587"|"20170704"|"FO20170704_PO32587"|"I Play"|"RB3A021036"|"I PLAY-IP-721159-614-43-Costumino Assorbente Mix'n Match Scimmiette-6- 12 Mesi"|"0000000002"|"0000000002"
"PO32587"|"3505217"|"20170711"|"20170711"|"PO32587"|"20170704"|"FO20170704_PO32587"|"I Play"|"RB3A021037"|"I PLAY-IP-721159-614-44-Costumino Assorbente Mix'n Match Scimmiette-12-18 Mesi"|"0000000002"|"0000000002"
"PO32587"|"3505217"|"20170711"|"20170711"|"PO32587"|"20170704"|"FO20170704_PO32587"|"I Play"|"RB3A021038"|"I PLAY-IP-721159-614-45-Costumino Assorbente Mix'n Match Scimmiette-18-24 Mesi"|"0000000002"|"0000000002"
"PO32587"|"3505217"|"20170711"|"20170711"|"PO32587"|"20170704"|"FO20170704_PO32587"|"I Play"|"RB3A021042"|"I PLAY-IP-721153-513-43-Costumino Assorbente Mix'n Match Amici della Savana-6- 12 Mesi"|"0000000002"|"0000000002"
"PO32587"|"3505217"|"20170711"|"20170711"|"PO32587"|"20170704"|"FO20170704_PO32587"|"I Play"|"RB3A021043"|"I PLAY-IP-721153-513-44-Costumino Assorbente Mix'n Match Amici della Savana-12-18 Mesi"|"0000000004"|"0000000004"
"PO32587"|"3505217"|"20170711"|"20170711"|"PO32587"|"20170704"|"FO20170704_PO32587"|"I Play"|"RB3A021044"|"I PLAY-IP-721153-513-45-Costumino Assorbente Mix'n Match Amici della Savana-18-24 Mesi"|"0000000004"|"0000000004"
"PO32588"|"3506217"|"20170711"|"20170711"|"PO32588"|"20170704"|"FO20170704_PO32588"|"Innobaby"|"RB3A015199"|"INNOBABY-IN-AQ-F01-Innobaby - AquaHeat Food Warmer - SOLO - 16 oz"|"0000000005"|"0000000005"
"PO32589"|"3507217"|"20170711"|"20170711"|"PO32589"|"20170704"|"FO20170704_PO32589"|"Kanga Care"|"RB3A011331"|"KANGA CARE-KC-KRWETB_OS-P118-Wet Bag Portapannolini Destiny"|"0000000001"|"0000000001"
"PO32590"|"3508217"|"20170711"|"20170711"|"PO32590"|"20170704"|"FO20170704_PO32590"|"Zoli"|"RB3A021063"|"ZOLI-ZL-KS12RFZE01-Ciondolo catarifrangente di sicurezza Peary"|"0000000001"|"0000000001"
"PO32591"|"3513217"|"20170711"|"20170711"|"PO32591"|"20170704"|"FO20170704_PO32591"|"IIAMO"|"RB3A015734"|"IIAMO-601-Biberon Home bianco e rosa"|"0000000006"|"0000000006"
"PO32591"|"3513217"|"20170711"|"20170711"|"PO32591"|"20170704"|"FO20170704_PO32591"|"IIAMO"|"RB3A015737"|"IIAMO-604-Biberon Home bianco e blu"|"0000000006"|"0000000006"
"PO32591"|"3513217"|"20170711"|"20170711"|"PO32591"|"20170704"|"FO20170704_PO32591"|"IIAMO"|"RB3A015738"|"IIAMO-105-Biberon Go bianco e rosa"|"0000000012"|"0000000012"
"PO32591"|"3513217"|"20170711"|"20170711"|"PO32591"|"20170704"|"FO20170704_PO32591"|"IIAMO"|"RB3A015741"|"IIAMO-108-Biberon Go bianco e blu"|"0000000012"|"0000000012"
"PO32591"|"3513217"|"20170711"|"20170711"|"PO32591"|"20170704"|"FO20170704_PO32591"|"IIAMO"|"RB3A015742"|"IIAMO-703-Cartucce termiche per biberon autoriscaldante"|"0000000096"|"0000000096"
"PO32591"|"3513217"|"20170711"|"20170711"|"PO32591"|"20170704"|"FO20170704_PO32591"|"IIAMO"|"RB3A015743"|"IIAMO-301-Tettarella biberon autoriscaldante da 0 mesi"|"0000000012"|"0000000012"
"PO32591"|"3513217"|"20170711"|"20170711"|"PO32591"|"20170704"|"FO20170704_PO32591"|"IIAMO"|"RB3A015744"|"IIAMO-303-Tettarella biberon autoriscaldante da 3 mesi"|"0000000012"|"0000000012"
"PO32591"|"3513217"|"20170711"|"20170711"|"PO32591"|"20170704"|"FO20170704_PO32591"|"IIAMO"|"RB3A015745"|"IIAMO-304-Tettarella biberon autoriscaldante da 6 mesi"|"0000000012"|"0000000012"
"PO32591"|"3513217"|"20170711"|"20170711"|"PO32591"|"20170704"|"FO20170704_PO32591"|"IIAMO"|"RB3A015746"|"IIAMO-305-Tettarella biberon autoriscaldante da 0 o 3 o 6 mesi"|"0000000012"|"0000000012"
"PO32612"|"3512217"|"20170711"|"20170711"|"PO32612"|"20170705"|"FO20170705_PO32612"|"Daikos"|"RB3A020264"|"DAIKOS-SQD217TU10-Pinna da Squalo Nera"|"0000000002"|"0000000002"
"PO32612"|"3512217"|"20170711"|"20170711"|"PO32612"|"20170705"|"FO20170705_PO32612"|"Daikos"|"RB3A020266"|"DAIKOS-SQD217TU50-Pinna da Squalo Rossa"|"0000000002"|"0000000002"
"RESO ORD. 32978"|"3514217"|"20170711"|"20170711"|""|"00000000"|"00002"|"ROCKETBABY"|"RB3A013472"|"BLADEeROSE-5060257461509-Hoodie Star Grey 3-6m"|"0000000000"|"0000000001"
"RESO ORD. 32978"|"3514217"|"20170711"|"20170711"|""|"00000000"|"00002"|"ROCKETBABY"|"RB3A013571"|"BLADEeROSE-5060257465750-Leggings Crazy Cat 0-6m"|"0000000000"|"0000000001"
"RESO ORD. 32978"|"3514217"|"20170711"|"20170711"|""|"00000000"|"00002"|"ROCKETBABY"|"RB3A019515"|"DELTA BABY-36001007-Delta Baby Borsa Fasciatoio da Viaggio Beige"|"0000000000"|"0000000001"
