"SpeNumeroOrdine"|"SpeNumeroProtocollo"|"SpeEtichettaCollo"|"SpeTrackingNumero"|"SpeDataImport"|"SpeRigaOrdine"|"SpeArtCodice"|"SpeArtDescrizione"|"SpeArtQta"|"SpeCostoContrassegno"
"#30941"|"28526317"|"00000000000000308659"|"201705005226702"|"20170605"|"1"|"RB3A019744"|"SUNNYLIFE-SU4BUWXB-Fishy Wind Up Bubbles"|"0000000001"|"0000031.86"
"#30940"|"28527317"|"00000000000000309769"|"201705005227938"|"20170605"|"1"|"RB3A019505"|"MUNCHKIN-11352-Pinguino Spara Bolle Munchkin"|"0000000001"|"0000035.76"
"#30936"|"28528317"|"00000000000000309759"|"201705005227939"|"20170605"|"1"|"RB3A019505"|"MUNCHKIN-11352-Pinguino Spara Bolle Munchkin"|"0000000001"|"0000035.76"
"#30935"|"28529317"|"00000000000000309749"|"201705005227940"|"20170605"|"1"|"RB3A019505"|"MUNCHKIN-11352-Pinguino Spara Bolle Munchkin"|"0000000001"|"0000035.76"
"#30931"|"28530317"|"00000000000000309739"|"201705005227941"|"20170605"|"1"|"RB3A019505"|"MUNCHKIN-11352-Pinguino Spara Bolle Munchkin"|"0000000001"|"0000035.76"
"#30925"|"28531317"|"00000000000000309919"|"201705005227440"|"20170605"|"1"|"RB3A011636"|"BIG MOUTH-BMBTDO-Telo da mare XXL Ciambella alla Fragola"|"0000000001"|"0000063.72"
"#30925"|"28531317"|"00000000000000309919"|"201705005227440"|"20170605"|"2"|"RB3A019505"|"MUNCHKIN-11352-Pinguino Spara Bolle Munchkin"|"0000000001"|"0000063.72"
"#30923"|"28532317"|"00000000000000309089"|"201705005226771"|"20170605"|"1"|"RB3A012354"|"CUPCAKE BABIES-CCBBW03-Set Baby Bath 2 in 1 Bianco"|"0000000001"|"0000037.76"
"#30922"|"28533317"|"00000000000000310169"|"201705005227714"|"20170605"|"1"|"RB3A019669"|"BUBBLEGUM STUFF-12435-Bubblegum Stuff Gentleman Baby Bottle Champagne Flute"|"0000000001"|"0000079.68"
"#30922"|"28533317"|"00000000000000310169"|"201705005227714"|"20170605"|"2"|"RB3A011636"|"BIG MOUTH-BMBTDO-Telo da mare XXL Ciambella alla Fragola"|"0000000001"|"0000079.68"
"#30922"|"28533317"|"00000000000000310169"|"201705005227714"|"20170605"|"3"|"RB3A019503"|"MUNCHKIN-11054-Papera Gonfiabile da Bagno Munchkin"|"0000000001"|"0000079.68"
"#30921"|"28534317"|"00000000000000309729"|"201705005227942"|"20170605"|"1"|"RB3A019505"|"MUNCHKIN-11352-Pinguino Spara Bolle Munchkin"|"0000000001"|"0000035.76"
"#30918"|"28535317"|"00000000000000310059"|"201705005227954"|"20170605"|"1"|"RB3A019505"|"MUNCHKIN-11352-Pinguino Spara Bolle Munchkin"|"0000000001"|"0000065.72"
"#30918"|"28535317"|"00000000000000310059"|"201705005227954"|"20170605"|"2"|"RB3A019503"|"MUNCHKIN-11054-Papera Gonfiabile da Bagno Munchkin"|"0000000001"|"0000065.72"
"#30916"|"28536317"|"00000000000000310149"|"201705005227996"|"20170605"|"1"|"RB3A019505"|"MUNCHKIN-11352-Pinguino Spara Bolle Munchkin"|"0000000001"|"0000072.12"
"#30916"|"28536317"|"00000000000000310149"|"201705005227996"|"20170605"|"2"|"RB3A012947"|"HAPPY HOPPERZ-HHZ03-Gonfiabile Cavalcabile Small Cane Blu"|"0000000001"|"0000072.12"
"#30911"|"28537317"|"00000000000000308799"|"201705005226678"|"20170605"|"1"|"RB3A017731"|"BLOOMING BATH-004019-Vasca A Fiore Per Il Bagnetto Fucsia"|"0000000001"|"0000057.70"
"#30907"|"28538317"|"00000000000000309299"|"201705005227175"|"20170605"|"1"|"RB3A009312"|"ROCKETBABY-RBP15100301-Cesto per Passeggino Camaleonte"|"0000000001"|"0000025.86"
"#30904"|"28539317"|"00000000000000309039"|"201705005226813"|"20170605"|"1"|"RB3A012457"|"VULLI-616324-Sophie la giraffa"|"0000000001"|"0000026.86"
"#30897"|"28540317"|"00000000000000309359"|"201705005227147"|"20170605"|"1"|"RB3A008318"|"COQ EN PATE-L13EACCBOBMBTIG-Cappellino Tigre S (6-18 mesi)"|"0000000001"|"0000020.86"
"#30896"|"28541317"|"00000000000000310129"|"201705005228033"|"20170605"|"1"|"RB3A014892"|"ROCKETBABY-RBP16334-Scatola Portagiochi Zebra"|"0000000001"|"0000115.36"
"#30896"|"28541317"|"00000000000000310129"|"201705005228033"|"20170605"|"2"|"RB3A014985"|"AQUASCALE-84231090-Vaschetta digitale con bilancia incorporata"|"0000000001"|"0000115.36"
"#30890"|"28542317"|"00000000000000308919"|"201705005226712"|"20170605"|"1"|"RB3A016475"|"ROCKETBABY-RBP16360-Cesto Passeggino Narvalo"|"0000000001"|"0000025.86"
"#30873"|"28543317"|"00000000000000309149"|"201705005226632"|"20170605"|"1"|"RB3A011135"|"ROCKETBABY-RBP16304-Cesto Contenitore ZigZag Giallo"|"0000000001"|"0000046.72"
"#30873"|"28543317"|"00000000000000309149"|"201705005226632"|"20170605"|"2"|"RB3A016475"|"ROCKETBABY-RBP16360-Cesto Passeggino Narvalo"|"0000000001"|"0000046.72"
"#30867"|"28544317"|"00000000000000308739"|"201705005226661"|"20170605"|"1"|"RB3A019593"|"BABY ELEPHANT EARS-1039-Baby Elephant Ears Cuscino Ergonomico con Grechine"|"0000000001"|"0000032.76"
"#30852"|"28545317"|"00000000000000309019"|"201705005227414"|"20170605"|"1"|"RB3A012952"|"HAPPY HOPPERZ-HHZ11-Gonfiabile Cavalcabile Medium Dino Verde"|"0000000001"|"0000074.12"
"#30852"|"28545317"|"00000000000000309019"|"201705005227414"|"20170605"|"2"|"RB3A019503"|"MUNCHKIN-11054-Papera Gonfiabile da Bagno Munchkin"|"0000000001"|"0000074.12"
"#30835"|"28546317"|"00000000000000309079"|"201705005226778"|"20170605"|"1"|"RB3A012355"|"CUPCAKE BABIES-CCBBT02-Set Baby Bath 2 in 1 Turchese"|"0000000001"|"0000041.76"
"#30833"|"28547317"|"00000000000000309279"|"201705005227271"|"20170605"|"1"|"RB3A009313"|"ROCKETBABY-RBP15100302-Cesto per Passeggino Elefante Verde"|"0000000001"|"0000025.86"
"#30818"|"28548317"|"00000000000000308889"|"201705005226716"|"20170605"|"1"|"RB3A016475"|"ROCKETBABY-RBP16360-Cesto Passeggino Narvalo"|"0000000001"|"0000025.86"
"#30802"|"28549317"|"00000000000000309899"|"201705005227423"|"20170605"|"1"|"RB3A019771"|"BIG MOUTH-BMBT-SB-Beach Blanket Strawberry 1.5m NEW"|"0000000001"|"0000063.72"
"#30802"|"28549317"|"00000000000000309899"|"201705005227423"|"20170605"|"2"|"RB3A011636"|"BIG MOUTH-BMBTDO-Telo da mare XXL Ciambella alla Fragola"|"0000000001"|"0000063.72"
"#30799"|"28550317"|"00000000000000308899"|"201705005226715"|"20170605"|"1"|"RB3A016475"|"ROCKETBABY-RBP16360-Cesto Passeggino Narvalo"|"0000000001"|"0000025.86"
"#30771"|"28551317"|"00000000000000308909"|"201705005226714"|"20170605"|"1"|"RB3A016475"|"ROCKETBABY-RBP16360-Cesto Passeggino Narvalo"|"0000000001"|"0000025.86"
"#30759"|"28552317"|"00000000000000308949"|"201705005227868"|"20170605"|"1"|"RB3A015742"|"IIAMO-703-Cartucce termiche per biberon autoriscaldante"|"0000000001"|"0000034.71"
"#30759"|"28552317"|"00000000000000308949"|"201705005227868"|"20170605"|"2"|"RB3A015738"|"IIAMO-105-Biberon Go bianco e rosa"|"0000000001"|"0000034.71"
"#30751"|"28553317"|"00000000000000309229"|"201705005227051"|"20170605"|"1"|"RB3A011071"|"FCTRY-SKSTA01-Calzine antiscivolo Sport Bianca e Blu"|"0000000001"|"0000071.49"
"#30751"|"28553317"|"00000000000000309229"|"201705005227051"|"20170605"|"2"|"RB3A009821"|"FCTRY-GLSTA25-Occhiali da Sole Baby Gialli 0-2 anni"|"0000000001"|"0000071.49"
"#30751"|"28553317"|"00000000000000309229"|"201705005227051"|"20170605"|"3"|"RB3A019662"|"FUNKIT WORLD-SMR-92-Funkit World Sacca da Spiaggia in Silicone Rosa"|"0000000001"|"0000071.49"
"#30751"|"28553317"|"00000000000000309229"|"201705005227051"|"20170605"|"4"|"RB3A019657"|"FUNKIT WORLD-SSP-54-Funkit World Paletta per la Sabbia in Silicone Verde Lime"|"0000000001"|"0000071.49"
"#30751"|"28553317"|"00000000000000309229"|"201705005227051"|"20170605"|"5"|"RB3A019654"|"FUNKIT WORLD-SMO-41-Funkit World Formine per la Sabbia in Silicone Blu"|"0000000001"|"0000071.49"
"#30751"|"28553317"|"00000000000000309229"|"201705005227051"|"20170605"|"6"|"RB3A019653"|"FUNKIT WORLD-SBU-06-Funkit World Secchiello da Spiaggia in Silicone Viola"|"0000000001"|"0000071.49"
"#30737"|"28554317"|"00000000000000309319"|"201705005227099"|"20170605"|"1"|"RB3A008432"|"BEATRIX NY-BEA0004.AI-Lunch Box Dinosauro Alister"|"0000000001"|"0000031.80"
"#30734"|"28555317"|"00000000000000309209"|"201705005227115"|"20170605"|"1"|"RB3A009901"|"A LITTLE LOVELY COMPANY-LTCW025-Lampada Mini Nuvoletta Bianca"|"0000000001"|"0000019.86"
"#30721"|"28556317"|"00000000000000309889"|"201705005227466"|"20170605"|"1"|"RB3A011636"|"BIG MOUTH-BMBTDO-Telo da mare XXL Ciambella alla Fragola"|"0000000002"|"0000149.00"
"#30721"|"28556317"|"00000000000000309889"|"201705005227466"|"20170605"|"2"|"RB3A019769"|"BIG MOUTH-BMBT-CS-Beach Blanket Cookie 1.5m NEW"|"0000000001"|"0000149.00"
"#30721"|"28556317"|"00000000000000309889"|"201705005227466"|"20170605"|"3"|"RB3A011637"|"BIG MOUTH-BMBTPI-Telo da mare XXL Pizza"|"0000000002"|"0000149.00"
"#30716"|"28557317"|"00000000000000308809"|"201705005226668"|"20170605"|"1"|"RB3A017532"|"LILIPUTI-2006004020073-Stretchy Wrap Folk Tale"|"0000000001"|"0000056.80"
"#30610"|"28558317"|"00000000000000310039"|"201705005227877"|"20170605"|"1"|"RB3A019647"|"MAMMA BABY OLCELLI-SOL50B-Mamma Baby Olcelli Crema per il Sole Baby Protezione 50+"|"0000000002"|"0000061.68"
"#30610"|"28558317"|"00000000000000310039"|"201705005227877"|"20170605"|"2"|"RB3A019648"|"MAMMA BABY OLCELLI-SOL30B-Mamma Baby Olcelli Crema per il Sole Baby Protezione 30"|"0000000001"|"0000061.68"
"#30582"|"28559317"|"00000000000000310239"|"201705005227805"|"20170605"|"1"|"RB3A011813"|"IPANEMA-22433-Sandali Ipanema Summer Baby Grigio 25/26"|"0000000001"|"0000091.60"
"#30582"|"28559317"|"00000000000000310239"|"201705005227805"|"20170605"|"2"|"RB3A019644"|"MAMMA BABY OLCELLI-AP150B-Mamma Baby Olcelli Acqua Profumata Baby 150 ml"|"0000000001"|"0000091.60"
"#30582"|"28559317"|"00000000000000310239"|"201705005227805"|"20170605"|"3"|"RB3A008322"|"COQ EN PATE-L13EACCBOBMBGIRCappellino Giraffa M (2-3 anni)"|"0000000001"|"0000091.60"
"#30582"|"28559317"|"00000000000000310239"|"201705005227805"|"20170605"|"4"|"RB3A019647"|"MAMMA BABY OLCELLI-SOL50B-Mamma Baby Olcelli Crema per il Sole Baby Protezione 50+"|"0000000001"|"0000091.60"
"#30582"|"28559317"|"00000000000000310239"|"201705005227805"|"20170605"|"5"|"RB3A019649"|"MAMMA BABY OLCELLI-DOSOLB-Mamma Baby Olcelli Crema Dopo Sole Baby"|"0000000001"|"0000091.60"
"#30581"|"28560317"|"00000000000000308709"|"201705005227692"|"20170605"|"1"|"RB3A019709"|"SUAVINEX-QS005DV02-DUCCIO STERILIZZACIUCCIO VERDE"|"0000000001"|"0000032.86"
"#30474"|"28561317"|"00000000000000308689"|"201705005227690"|"20170605"|"1"|"RB3A019709"|"SUAVINEX-QS005DV02-DUCCIO STERILIZZACIUCCIO VERDE"|"0000000001"|"0000032.86"
"#30162"|"28562317"|"00000000000000308699"|"201705005227691"|"20170605"|"1"|"RB3A019709"|"SUAVINEX-QS005DV02-DUCCIO STERILIZZACIUCCIO VERDE"|"0000000001"|"0000032.86"
"#30021"|"28563317"|"00000000000000310049"|"201705005227923"|"20170605"|"1"|"RB3A019645"|"MAMMA BABY OLCELLI-CVC100B-Mamma Baby Olcelli Crema Viso/Corpo Baby 100 ml"|"0000000001"|"0000050.68"
"#30021"|"28563317"|"00000000000000310049"|"201705005227923"|"20170605"|"2"|"RB3A019649"|"MAMMA BABY OLCELLI-DOSOLB-Mamma Baby Olcelli Crema Dopo Sole Baby"|"0000000001"|"0000050.68"
"#30021"|"28563317"|"00000000000000310049"|"201705005227923"|"20170605"|"3"|"RB3A019647"|"MAMMA BABY OLCELLI-SOL50B-Mamma Baby Olcelli Crema per il Sole Baby Protezione 50+"|"0000000001"|"0000050.68"
"#29926"|"28564317"|"00000000000000309479"|"201705005227888"|"20170605"|"1"|"RB3A019754"|"SUNNYLIFE-SULARMFL-Inflatable Arm Band Mingo"|"0000000001"|"0000020.86"
"#29849"|"28565317"|"00000000000000310069"|"201705005227910"|"20170605"|"1"|"RB3A019059"|"TOBY TIGER-SHREST-Toby Tiger Pantaloncini Stelle-1-2 Anni"|"0000000002"|"0000137.64"
"#29849"|"28565317"|"00000000000000310069"|"201705005227910"|"20170605"|"2"|"RB3A018973"|"TOBY TIGER-DUCBWHALE-Toby Tiger Salopette Blu Balena-1-2 Anni"|"0000000002"|"0000137.64"
"#28880"|"28566317"|"00000000000000309409"|"201705005227174"|"20170605"|"1"|"RB3A019753"|"SUNNYLIFE-SULARMCR-Inflatable Arm Band Crabby"|"0000000002"|"0000035.72"
"#28916"|"28567317"|"00000000000000309419"|"201705005227173"|"20170605"|"1"|"RB3A019754"|"SUNNYLIFE-SULARMFL-Inflatable Arm Band Mingo"|"0000000001"|"0000032.93"
"#28916"|"28567317"|"00000000000000309419"|"201705005227173"|"20170605"|"2"|"RB3A019753"|"SUNNYLIFE-SULARMCR-Inflatable Arm Band Crabby"|"0000000001"|"0000032.93"
"#28891"|"28568317"|"00000000000000309429"|"201705005227165"|"20170605"|"2"|"RB3A019753"|"SUNNYLIFE-SULARMCR-Inflatable Arm Band Crabby"|"0000000001"|"0000013.96"
"#28877"|"28569317"|"00000000000000309439"|"201705005227167"|"20170605"|"3"|"RB3A019753"|"SUNNYLIFE-SULARMCR-Inflatable Arm Band Crabby"|"0000000001"|"0000013.96"
"#29591"|"28570317"|"00000000000000309779"|"201705005227346"|"20170605"|"9"|"RB3A019633"|"I PLAY-721054-642-Iplay Costumino Pannolino Contenitivo Mix'n Match Royal Viking Sea-18 Mesi"|"0000000001"|"0000014.96"
"#29387"|"28571317"|"00000000000000309629"|"201705005227331"|"20170605"|"1"|"RB3A019751"|"SUNNYLIFE-SU8STWFL-Flamingo Honeycomb Straws"|"0000000001"|"0000009.96"
"#29279"|"28572317"|"00000000000000309699"|"201705005227931"|"20170605"|"3"|"RB3A019739"|"SUNNYLIFE-SUICAMHA-Underwater Camera Havana"|"0000000001"|"0000019.96"
"#29211"|"28573317"|"00000000000000309619"|"201705005227327"|"20170605"|"1"|"RB3A019751"|"SUNNYLIFE-SU8STWFL-Flamingo Honeycomb Straws"|"0000000004"|"0000039.84"
"#30932"|"28574317"|"00000000000000308999"|"201705005226831"|"20170605"|"1"|"RB3A013421"|"ELODIE DETAILS-103889-Zaino Pretty Petrol"|"0000000001"|"0000000.00"
"#30929"|"28575317"|"00000000000000310099"|"201705005227613"|"20170605"|"1"|"RB3A017407"|"BOON-B11013-Termometro da Bagno"|"0000000001"|"0000000.00"
"#30929"|"28575317"|"00000000000000310099"|"201705005227613"|"20170605"|"2"|"RB3A019505"|"MUNCHKIN-11352-Pinguino Spara Bolle Munchkin"|"0000000001"|"0000000.00"
"#30928"|"28576317"|"00000000000000309069"|"201705005226777"|"20170605"|"1"|"RB3A012355"|"CUPCAKE BABIES-CCBBT02-Set Baby Bath 2 in 1 Turchese"|"0000000001"|"0000000.00"
"#30894"|"28577317"|"00000000000000309869"|"201705005227628"|"20170605"|"1"|"RB3A011636"|"BIG MOUTH-BMBTDO-Telo da mare XXL Ciambella alla Fragola"|"0000000001"|"0000000.00"
"#30883"|"28578317"|"00000000000000310159"|"201705005227720"|"20170605"|"1"|"RB3A012355"|"CUPCAKE BABIES-CCBBT02-Set Baby Bath 2 in 1 Turchese"|"0000000001"|"0000000.00"
"#30883"|"28578317"|"00000000000000310159"|"201705005227720"|"20170605"|"2"|"RB3A018624"|"CHEEKY CHOMPERS-CC009-Bavaglino a Bandana con Gioco per la Dentizione Incorporato Twinkle Twinkle"|"0000000001"|"0000000.00"
"#30863"|"28579317"|"00000000000000308769"|"201705005226607"|"20170605"|"1"|"RB3A018705"|"COQ EN PATE-L17EACCBOBPHO-Coq en Pate Cappellino Foca-M"|"0000000001"|"0000000.00"
"#30862"|"28580317"|"00000000000000309119"|"201705005226821"|"20170605"|"1"|"RB3A016475"|"ROCKETBABY-RBP16360-Cesto Passeggino Narvalo"|"0000000001"|"0000000.00"
"#30862"|"28580317"|"00000000000000309119"|"201705005226821"|"20170605"|"2"|"RB3A011908"|"KANGA CARE-KC-KRRUMPSOS-P126-Pannolino Rumparooz Dragons Fly"|"0000000001"|"0000000.00"
"#30862"|"28580317"|"00000000000000309119"|"201705005226821"|"20170605"|"3"|"RB3A019503"|"MUNCHKIN-11054-Papera Gonfiabile da Bagno Munchkin"|"0000000001"|"0000000.00"
"#30859"|"28581317"|"00000000000000308969"|"201705005226853"|"20170605"|"1"|"RB3A014886"|"ROCKETBABY-RBP16349-Sacco Nanna Balena Rosso Lava"|"0000000001"|"0000000.00"
"#30826"|"28582317"|"00000000000000309949"|"201705005227641"|"20170605"|"1"|"RB3A011311"|"KANGA CARE-KC-C4025SP-Pannolino Rumparooz Quinn"|"0000000001"|"0000000.00"
"#30824"|"28583317"|"00000000000000310119"|"201705005228091"|"20170605"|"1"|"RB3A014986"|"AQUASCALE-94032080-Supporto per vaschetta digitale"|"0000000001"|"0000000.00"
"#30824"|"28583317"|"00000000000000310119"|"201705005228091"|"20170605"|"2"|"RB3A014985"|"AQUASCALE-84231090-Vaschetta digitale con bilancia incorporata"|"0000000001"|"0000000.00"
"#30824"|"28583317"|"00000000000000310119"|"201705005228091"|"20170605"|"3"|"RB3A014894"|"ROCKETBABY-RBP16336-Scatola Portagiochi Balena"|"0000000001"|"0000000.00"
"#30824"|"28583317"|"00000000000000310119"|"201705005228091"|"20170605"|"4"|"RB3A014896"|"ROCKETBABY-RBP16338-Scatola Portagiochi Elefante"|"0000000001"|"0000000.00"
"#30824"|"28583317"|"00000000000000310119"|"201705005228091"|"20170605"|"5"|"RB3A014893"|"ROCKETBABY-RBP16335-Scatola Portagiochi Leone"|"0000000001"|"0000000.00"
"#30824"|"28583317"|"00000000000000310119"|"201705005228091"|"20170605"|"6"|"RB3A016475"|"ROCKETBABY-RBP16360-Cesto Passeggino Narvalo"|"0000000001"|"0000000.00"
"#30822"|"28584317"|"00000000000000308939"|"201705005227863"|"20170605"|"1"|"RB3A015742"|"IIAMO-703-Cartucce termiche per biberon autoriscaldante"|"0000000002"|"0000000.00"
"#30822"|"28584317"|"00000000000000308939"|"201705005227863"|"20170605"|"2"|"RB3A015738"|"IIAMO-105-Biberon Go bianco e rosa"|"0000000001"|"0000000.00"
"#30811"|"28585317"|"00000000000000308839"|"201705005226866"|"20170605"|"1"|"RB3A016476"|"ROCKETBABY-RBP16361-Cesto Passeggino Coniglio"|"0000000001"|"0000000.00"
"#30811"|"28585317"|"00000000000000308839"|"201705005226866"|"20170605"|"2"|"RB3A020170"|"DIAPERCHAMP-DCM-Pattumiera Mangiapannolini Intrappolaodori Medium"|"0000000001"|"0000000.00"
"#30795"|"28586317"|"00000000000000308779"|"201705005226697"|"20170605"|"1"|"RB3A018640"|"LITTLELIFE-L10880-Zaino Littlelife 1-3 anni Coccodrillo"|"0000000001"|"0000000.00"
"#30793"|"28587317"|"00000000000000309839"|"201705005228052"|"20170605"|"1"|"RB3A014985"|"AQUASCALE-84231090-Vaschetta digitale con bilancia incorporata"|"0000000001"|"0000000.00"
"#30792"|"28588317"|"00000000000000309859"|"201705005227626"|"20170605"|"1"|"RB3A011636"|"BIG MOUTH-BMBTDO-Telo da mare XXL Ciambella alla Fragola"|"0000000001"|"0000000.00"
"#30780"|"28589317"|"00000000000000309959"|"201705005227486"|"20170605"|"1"|"RB3A009819"|"FCTRY-GLSTA23-Occhiali da Sole Baby Rosa 0-2 anni"|"0000000002"|"0000000.00"
"#30776"|"28590317"|"00000000000000308679"|"201705005227687"|"20170605"|"1"|"RB3A019709"|"SUAVINEX-QS005DV02-DUCCIO STERILIZZACIUCCIO VERDE"|"0000000001"|"0000000.00"
"#30768"|"28591317"|"00000000000000310079"|"201705005227968"|"20170605"|"1"|"RB3A019658"|"FUNKIT WORLD-SSP-55-Funkit World Paletta per la Sabbia in Silicone Rosa"|"0000000001"|"0000000.00"
"#30768"|"28591317"|"00000000000000310079"|"201705005227968"|"20170605"|"2"|"RB3A019657"|"FUNKIT WORLD-SSP-54-Funkit World Paletta per la Sabbia in Silicone Verde Lime"|"0000000001"|"0000000.00"
"#30768"|"28591317"|"00000000000000310079"|"201705005227968"|"20170605"|"3"|"RB3A019651"|"FUNKIT WORLD-SBU-03-Funkit World Secchiello da Spiaggia in Silicone Verde"|"0000000001"|"0000000.00"
"#30768"|"28591317"|"00000000000000310079"|"201705005227968"|"20170605"|"4"|"RB3A019652"|"FUNKIT WORLD-SBU-05-Funkit World Secchiello da Spiaggia in Silicone Rosa"|"0000000001"|"0000000.00"
"#30768"|"28591317"|"00000000000000310079"|"201705005227968"|"20170605"|"5"|"RB3A019656"|"FUNKIT WORLD-SSP-53-Funkit World Paletta per la Sabbia in Silicone Viola"|"0000000001"|"0000000.00"
"#30768"|"28591317"|"00000000000000310079"|"201705005227968"|"20170605"|"6"|"RB3A019653"|"FUNKIT WORLD-SBU-06-Funkit World Secchiello da Spiaggia in Silicone Viola"|"0000000001"|"0000000.00"
"#30768"|"28591317"|"00000000000000310079"|"201705005227968"|"20170605"|"7"|"RB3A018734"|"BS-BTSGA145-Gioco BS Ring Toss"|"0000000002"|"0000000.00"
"#30767"|"28592317"|"00000000000000308789"|"201705005226694"|"20170605"|"1"|"RB3A018637"|"LITTLELIFE-L10810-Zaino Littlelife 1-3 anni Nemo"|"0000000001"|"0000000.00"
"#30752"|"28593317"|"00000000000000310109"|"201705005228080"|"20170605"|"1"|"RB3A014893"|"ROCKETBABY-RBP16335-Scatola Portagiochi Leone"|"0000000001"|"0000000.00"
"#30752"|"28593317"|"00000000000000310109"|"201705005228080"|"20170605"|"2"|"RB3A017733"|"BLOOMING BATH-004021-Vasca A Fiore Per Il Bagnetto Azzurra"|"0000000001"|"0000000.00"
"#30752"|"28593317"|"00000000000000310109"|"201705005228080"|"20170605"|"3"|"RB3A017755"|"YOOKIDOO-YKD40126-Gymotion Activity PlayLand"|"0000000001"|"0000000.00"
"#30723"|"28594317"|"00000000000000309999"|"201705005227502"|"20170605"|"1"|"RB3A019657"|"FUNKIT WORLD-SSP-54-Funkit World Paletta per la Sabbia in Silicone Verde Lime"|"0000000001"|"0000000.00"
"#30723"|"28594317"|"00000000000000309999"|"201705005227502"|"20170605"|"2"|"RB3A019651"|"FUNKIT WORLD-SBU-03-Funkit World Secchiello da Spiaggia in Silicone Verde"|"0000000001"|"0000000.00"
"#30666"|"28595317"|"00000000000000308669"|"201705005227686"|"20170605"|"1"|"RB3A019709"|"SUAVINEX-QS005DV02-DUCCIO STERILIZZACIUCCIO VERDE"|"0000000001"|"0000000.00"
"#30638"|"28596317"|"00000000000000310019"|"201705005227575"|"20170605"|"1"|"RB3A019654"|"FUNKIT WORLD-SMO-41-Funkit World Formine per la Sabbia in Silicone Blu"|"0000000001"|"0000000.00"
"#30638"|"28596317"|"00000000000000310019"|"201705005227575"|"20170605"|"2"|"RB3A019655"|"FUNKIT WORLD-SSP-51-Funkit World Paletta per la Sabbia in Silicone Blu"|"0000000001"|"0000000.00"
"#30638"|"28596317"|"00000000000000310019"|"201705005227575"|"20170605"|"3"|"RB3A019650"|"FUNKIT WORLD-SBU-01-Funkit World Secchiello da Spiaggia in Silicone Blu"|"0000000001"|"0000000.00"
"#29844"|"28597317"|"00000000000000309989"|"201705005227506"|"20170605"|"1"|"RB3A011095"|"COQ EN PATE-L16ACCBOBMBLEM-Cappellino Lemure S"|"0000000001"|"0000000.00"
"#29844"|"28597317"|"00000000000000309989"|"201705005227506"|"20170605"|"2"|"RB3A008309"|"COQ EN PATE-L15ACCBOBMBPAN-Cappellino Panda S (6-18 mesi)"|"0000000001"|"0000000.00"
"#29771"|"28598317"|"00000000000000309599"|"201705005227957"|"20170605"|"1"|"RB3A020169"|"DIAPERCHAMP-DCR-Pattumiera Mangiapannolini Intrappolaodori Regular"|"0000000001"|"0000000.00"
"#29705"|"28599317"|"00000000000000310089"|"201705005228064"|"20170605"|"1"|"RB3A019643"|"MAMMA BABY OLCELLI-LCLMB-Mamma Baby Olcelli Pochette per Prodotti da Bagno con Pantofoline Baby"|"0000000001"|"0000000.00"
"#29705"|"28599317"|"00000000000000310089"|"201705005228064"|"20170605"|"2"|"RB3A019649"|"MAMMA BABY OLCELLI-DOSOLB-Mamma Baby Olcelli Crema Dopo Sole Baby"|"0000000001"|"0000000.00"
"#29705"|"28599317"|"00000000000000310089"|"201705005228064"|"20170605"|"3"|"RB3A019647"|"MAMMA BABY OLCELLI-SOL50B-Mamma Baby Olcelli Crema per il Sole Baby Protezione 50+"|"0000000001"|"0000000.00"
"#29705"|"28599317"|"00000000000000310089"|"201705005228064"|"20170605"|"4"|"RB3A017411"|"BOON-B407-Balena Portaoggetti Per La Vasca"|"0000000001"|"0000000.00"
"#29705"|"28599317"|"00000000000000310089"|"201705005228064"|"20170605"|"5"|"RB3A019529"|"FUNKY BOX-FB25-Porta Salviettine Umidificate Misty Grey Cloud"|"0000000001"|"0000000.00"
"#29705"|"28599317"|"00000000000000310089"|"201705005228064"|"20170605"|"6"|"RB3A019454"|"FUNKY BOX-FBTG01-Porta Salviettine Umidificate da Viaggio Funky Box Azzurro con Stella Bianca"|"0000000001"|"0000000.00"
"#29705"|"28599317"|"00000000000000310089"|"201705005228064"|"20170605"|"7"|"RB3A019754"|"SUNNYLIFE-SULARMFL-Inflatable Arm Band Mingo"|"0000000001"|"0000000.00"
"#29705"|"28599317"|"00000000000000310089"|"201705005228064"|"20170605"|"8"|"RB3A020107"|"IGOR SHOES-S10107-083-Sandali da Spiaggia Tenis Azzurro-19"|"0000000001"|"0000000.00"
"#29705"|"28599317"|"00000000000000310089"|"201705005228064"|"20170605"|"9"|"RB3A020158"|"IGOR SHOES-S10107-188-Sandali da Spiaggia Tenis Acquamarina-22"|"0000000001"|"0000000.00"
"#29704"|"28600317"|"00000000000000310209"|"201705005227748"|"20170605"|"1"|"RB3A011099"|"COQ EN PATE-L16ACCBOBMBELE-Cappellino Elefante M"|"0000000001"|"0000000.00"
"#29704"|"28600317"|"00000000000000310209"|"201705005227748"|"20170605"|"2"|"RB3A020078"|"IGOR SHOES-S10107-073-Sandali da Spiaggia Tenis Fucsia-22"|"0000000001"|"0000000.00"
"#30949"|"28601317"|"00000000000000309099"|"201705005226767"|"20170605"|"1"|"RB3A012353"|"CUPCAKE BABIES-CCBBF01-Set Baby Bath 2 in 1 Fucsia"|"0000000001"|"0000000.00"
"#30924"|"28602317"|"00000000000000309049"|"201705005227849"|"20170605"|"1"|"RB3A012381"|"THE MAGIC DOOR STORE-Magic Dust-Polvere di stelle"|"0000000001"|"0000000.00"
"#30924"|"28602317"|"00000000000000309049"|"201705005227849"|"20170605"|"2"|"RB3A012383"|"THE MAGIC DOOR STORE-0700461482536-Magiche Impronte"|"0000000002"|"0000000.00"
"#30912"|"28603317"|"00000000000000308959"|"201705005226836"|"20170605"|"1"|"RB3A014894"|"ROCKETBABY-RBP16336-Scatola Portagiochi Balena"|"0000000001"|"0000000.00"
"#30912"|"28603317"|"00000000000000308959"|"201705005226836"|"20170605"|"2"|"RB3A014895"|"ROCKETBABY-RBP16337-Scatola Portagiochi Coniglio"|"0000000001"|"0000000.00"
"#30866"|"28604317"|"00000000000000309969"|"201705005227477"|"20170605"|"1"|"RB3A009818"|"FCTRY-GLSTA22-Occhiali da Sole Baby Bianchi 0-2 anni"|"0000000001"|"0000000.00"
"#30861"|"28605317"|"00000000000000309259"|"201705005227104"|"20170605"|"1"|"RB3A009314"|"ROCKETBABY-RBP15100303-Cesto per Passeggino Riccio"|"0000000001"|"0000000.00"
"#30847"|"28606317"|"00000000000000309169"|"201705005226624"|"20170605"|"1"|"RB3A010006"|"CHILDHOME-CCFTBRMB-Borsone Portagiochi Round Grigia e Menta"|"0000000001"|"0000000.00"
"#30834"|"28607317"|"00000000000000309059"|"201705005226776"|"20170605"|"1"|"RB3A012355"|"CUPCAKE BABIES-CCBBT02-Set Baby Bath 2 in 1 Turchese"|"0000000001"|"0000000.00"
"#30819"|"28608317"|"00000000000000309929"|"201705005227445"|"20170605"|"1"|"RB3A011635"|"BIG MOUTH-BMBTBU-Telo da mare XXL Hamburger Gigante"|"0000000001"|"0000000.00"
"#30819"|"28608317"|"00000000000000309929"|"201705005227445"|"20170605"|"2"|"RB3A011636"|"BIG MOUTH-BMBTDO-Telo da mare XXL Ciambella alla Fragola"|"0000000001"|"0000000.00"
"#30816"|"28609317"|"00000000000000310189"|"201705005227981"|"20170605"|"1"|"RB3A011629"|"BIG MOUTH-BMPFPO-Materassino gonfiabile XXL Pop Corn"|"0000000001"|"0000000.00"
"#30816"|"28609317"|"00000000000000310189"|"201705005227981"|"20170605"|"2"|"RB3A012355"|"CUPCAKE BABIES-CCBBT02-Set Baby Bath 2 in 1 Turchese"|"0000000001"|"0000000.00"
"#30816"|"28609317"|"00000000000000310189"|"201705005227981"|"20170605"|"3"|"RB3A012354"|"CUPCAKE BABIES-CCBBW03-Set Baby Bath 2 in 1 Bianco"|"0000000001"|"0000000.00"
"#30816"|"28609317"|"00000000000000310189"|"201705005227981"|"20170605"|"4"|"RB3A011636"|"BIG MOUTH-BMBTDO-Telo da mare XXL Ciambella alla Fragola"|"0000000001"|"0000000.00"
