"SpeNumeroOrdine"|"SpeNumeroProtocollo"|"SpeEtichettaCollo"|"SpeTrackingNumero"|"SpeDataImport"|"SpeRigaOrdine"|"SpeArtCodice"|"SpeArtDescrizione"|"SpeArtQta"|"SpeCostoContrassegno"
"#28924"|"26693317"|"00000000000000286469"|"201705005185398"|"20170508"|"1"|"RB3A019516"|"BOON-B10087-Boon Rana Portaoggetti Da Bagno"|"0000000001"|"0000083.82"
"#28924"|"26693317"|"00000000000000286469"|"201705005185398"|"20170508"|"2"|"RB3A019505"|"MUNCHKIN-11352-Pinguino Spara Bolle Munchkin"|"0000000001"|"0000083.82"
"#28923"|"26694317"|"00000000000000286449"|"201705005185339"|"20170508"|"1"|"RB3A009313"|"ROCKETBABY-RBP15100302-Cesto per Passeggino Elefante Verde"|"0000000001"|"0000025.86"
"#28921"|"26695317"|"00000000000000286569"|"201705005185236"|"20170508"|"1"|"RB3A016476"|"ROCKETBABY-RBP16361-Cesto Passeggino Coniglio"|"0000000001"|"0000025.86"
"#28913"|"26696317"|"00000000000000286539"|"201705005185296"|"20170508"|"1"|"RB3A016475"|"ROCKETBABY-RBP16360-Cesto Passeggino Narvalo"|"0000000001"|"0000025.86"
"#28912"|"26697317"|"00000000000000286479"|"201705005185328"|"20170508"|"1"|"RB3A018610"|"BOON-B11177-Pulp Mangiafrutta Dentaruolo Arancione e Azzurro"|"0000000001"|"0000017.86"
"#28900"|"26698317"|"00000000000000286429"|"201705005185420"|"20170508"|"1"|"RB3A009314"|"ROCKETBABY-RBP15100303-Cesto per Passeggino Riccio"|"0000000001"|"0000025.86"
"#28899"|"26699317"|"00000000000000286549"|"201705005185292"|"20170508"|"1"|"RB3A016475"|"ROCKETBABY-RBP16360-Cesto Passeggino Narvalo"|"0000000001"|"0000025.86"
"#28613"|"26700317"|"00000000000000286799"|"201705005185690"|"20170508"|"1"|"RB3A014985"|"AQUASCALE-84231090-Vaschetta digitale con bilancia incorporata"|"0000000001"|"0000094.40"
"#28604"|"26701317"|"00000000000000286809"|"201705005185691"|"20170508"|"1"|"RB3A014985"|"AQUASCALE-84231090-Vaschetta digitale con bilancia incorporata"|"0000000001"|"0000094.40"
"#28503"|"26702317"|"00000000000000286819"|"201705005185692"|"20170508"|"1"|"RB3A014985"|"AQUASCALE-84231090-Vaschetta digitale con bilancia incorporata"|"0000000001"|"0000094.40"
"#28441"|"26703317"|"00000000000000286729"|"201705005185886"|"20170508"|"1"|"RB3A019643"|"MAMMA BABY OLCELLI-LCLMB-Mamma Baby Olcelli Pochette per Prodotti da Bagno con Pantofoline Baby"|"0000000001"|"0000128.66"
"#28441"|"26703317"|"00000000000000286729"|"201705005185886"|"20170508"|"2"|"RB3A018903"|"NOPPIES-74264_C093-Noppies Maglia a Maniche Lunghe Hello Sunshine Rosa e Bianco Baby-80 cm"|"0000000001"|"0000128.66"
"#28441"|"26703317"|"00000000000000286729"|"201705005185886"|"20170508"|"3"|"RB3A018754"|"NOPPIES-74364_C094-Noppies Pantaloni Rosa con Fiocchetto Baby-80 cm"|"0000000001"|"0000128.66"
"#28441"|"26703317"|"00000000000000286729"|"201705005185886"|"20170508"|"4"|"RB3A018775"|"NOPPIES-74369-Noppies Maglietta a Maniche Corte a Coriandoli con Cuore in Rilievo Baby-80 cm"|"0000000001"|"0000128.66"
"#28441"|"26703317"|"00000000000000286729"|"201705005185886"|"20170508"|"5"|"RB3A019442"|"EFFII-5901832942764-Effii Telo Mare e Tappeto 2 in 1 Piccolo con Cuori Rosa"|"0000000001"|"0000128.66"
"#28441"|"26703317"|"00000000000000286729"|"201705005185886"|"20170508"|"6"|"RB3A016477"|"ROCKETBABY-RBP16362-Cesto Passeggino Pecora"|"0000000001"|"0000128.66"
"#28395"|"26704317"|"00000000000000286959"|"201705005186070"|"20170508"|"1"|"RB3A019520"|"DOODOO-121-BabiAge DooDoo 0121 coniglio a pois beige"|"0000000001"|"0000047.76"
"#28365"|"26705317"|"00000000000000286969"|"201705005186069"|"20170508"|"1"|"RB3A019520"|"DOODOO-121-BabiAge DooDoo 0121 coniglio a pois beige"|"0000000001"|"0000047.76"
"#28289"|"26706317"|"00000000000000286669"|"201705005185053"|"20170508"|"1"|"RB3A019473"|"DONE BY DEER-40622-Palestrina Gioco Blu"|"0000000001"|"0000160.20"
"#28289"|"26706317"|"00000000000000286669"|"201705005185053"|"20170508"|"2"|"RB3A009850"|"ELODIE DETAILS-103434-Bavaglino Bandana Petit Royal Blue"|"0000000001"|"0000160.20"
"#28289"|"26706317"|"00000000000000286669"|"201705005185053"|"20170508"|"3"|"RB3A019522"|"DOODOO-130-BabiAge DooDoo NightLight 130"|"0000000001"|"0000160.20"
"#28287"|"26707317"|"00000000000000286719"|"201705005185619"|"20170508"|"1"|"RB3A017491"|"BOON-B10122A-Cucchiaio Dispenser Per La Pappa Azzurro"|"0000000001"|"0000109.78"
"#28287"|"26707317"|"00000000000000286719"|"201705005185619"|"20170508"|"2"|"RB3A016477"|"ROCKETBABY-RBP16362-Cesto Passeggino Pecora"|"0000000001"|"0000109.78"
"#28287"|"26707317"|"00000000000000286719"|"201705005185619"|"20170508"|"3"|"RB3A017485"|"EFFII-5901832944669-Cuscino Allattamento Luna Blu XXL"|"0000000001"|"0000109.78"
"#28287"|"26707317"|"00000000000000286719"|"201705005185619"|"20170508"|"4"|"RB3A012354"|"CUPCAKE BABIES-CCBBW03-Set Baby Bath 2 in 1 Bianco"|"0000000001"|"0000109.78"
"#28277"|"26708317"|"00000000000000286919"|"201705005185932"|"20170508"|"1"|"RB3A017512"|"LILIPUTI-2006002020211-Marsupio Rainbow Line Zig Zag Marrone"|"0000000001"|"0000135.90"
"#28261"|"26709317"|"00000000000000286979"|"201705005186068"|"20170508"|"1"|"RB3A019520"|"DOODOO-121-BabiAge DooDoo 0121 coniglio a pois beige"|"0000000001"|"0000047.76"
"#28260"|"26710317"|"00000000000000287079"|"201705005186029"|"20170508"|"1"|"RB3A019522"|"DOODOO-130-BabiAge DooDoo NightLight 130"|"0000000001"|"0000051.76"
"#28187"|"26711317"|"00000000000000286899"|"201705005186151"|"20170508"|"1"|"RB3A019521"|"DOODOO-122-BabiAge DooDoo 0122 coniglio a strisce grigio"|"0000000001"|"0000062.76"
"#28187"|"26711317"|"00000000000000286899"|"201705005186151"|"20170508"|"2"|"RB3A017451"|"EFFII-5901832942078-Cuffia Neonato Bianca Con Stelle Grigie 0-1 mese"|"0000000001"|"0000062.76"
"#28167"|"26712317"|"00000000000000287119"|"201705005186141"|"20170508"|"1"|"RB3A019667"|"DOODOO-102-BabyAge DooDoo 102 Orsetto Beige"|"0000000001"|"0000047.76"
"#28140"|"26713317"|"00000000000000286749"|"201705005185824"|"20170508"|"1"|"RB3A016507"|"KANGA CARE-KCKRLLNZSXSM401-Set 2 Mutandine Di Transizione Dragons Fly e Invader S"|"0000000001"|"0000095.68"
"#28140"|"26713317"|"00000000000000286749"|"201705005185824"|"20170508"|"2"|"RB3A019438"|"EFFII-5901832942795-Effii Telo Mare e Tappeto 2 in 1 Grande con Stelle Verdi"|"0000000001"|"0000095.68"
"#28140"|"26713317"|"00000000000000286749"|"201705005185824"|"20170508"|"3"|"RB3A019459"|"FUNKY BOX-FBTG15-Porta Salviettine Umidificate da Viaggio Funky Box Grigio Scuro con Stella Bianca"|"0000000001"|"0000095.68"
"#28138"|"26714317"|"00000000000000287149"|"201705005186143"|"20170508"|"1"|"RB3A019668"|"DOODOO-103-BabyAge DooDoo 103 Orsetto Beige"|"0000000001"|"0000047.76"
"#28021"|"26715317"|"00000000000000287049"|"201705005186006"|"20170508"|"1"|"RB3A019521"|"DOODOO-122-BabiAge DooDoo 0122 coniglio a strisce grigio"|"0000000001"|"0000047.76"
"#28927"|"26716317"|"00000000000000286509"|"201705005185320"|"20170508"|"1"|"RB3A018611"|"BOON-B11179-Pulp Mangiafrutta Dentaruolo Verde e Azzurro"|"0000000001"|"0000000.00"
"#28927"|"26716317"|"00000000000000286509"|"201705005185320"|"20170508"|"2"|"RB3A011075"|"FCTRY-SKSTA07-Calzine antiscivolo Losanga Marrone"|"0000000001"|"0000000.00"
"#28927"|"26716317"|"00000000000000286509"|"201705005185320"|"20170508"|"3"|"RB3A011070"|"FCTRY-SKSTA05-Calzine antiscivolo Losanga Blu"|"0000000001"|"0000000.00"
"#28927"|"26716317"|"00000000000000286509"|"201705005185320"|"20170508"|"4"|"RB3A011076"|"FCTRY-SKSTA06-Calzine antiscivolo Losanga Antracite"|"0000000001"|"0000000.00"
"#28909"|"26717317"|"00000000000000286529"|"201705005185358"|"20170508"|"1"|"RB3A010107"|"ELODIE DETAILS-103421-Bavaglino Colori del Vento"|"0000000001"|"0000000.00"
"#28871"|"26718317"|"00000000000000287059"|"201705005186005"|"20170508"|"1"|"RB3A019521"|"DOODOO-122-BabiAge DooDoo 0122 coniglio a strisce grigio"|"0000000001"|"0000000.00"
"#28743"|"26719317"|"00000000000000286829"|"201705005185740"|"20170508"|"1"|"RB3A014986"|"AQUASCALE-94032080-Supporto per vaschetta digitale"|"0000000001"|"0000000.00"
"#28743"|"26719317"|"00000000000000286829"|"201705005185740"|"20170508"|"2"|"RB3A014985"|"AQUASCALE-84231090-Vaschetta digitale con bilancia incorporata"|"0000000001"|"0000000.00"
"#28633"|"26720317"|"00000000000000286989"|"201705005186066"|"20170508"|"1"|"RB3A019520"|"DOODOO-121-BabiAge DooDoo 0121 coniglio a pois beige"|"0000000001"|"0000000.00"
"#28488"|"26721317"|"00000000000000286589"|"201705005185254"|"20170508"|"1"|"RB20012T"|"Duux-DUBP02-Proiettore per Bambini Bluetooth"|"0000000001"|"0000000.00"
"#28488"|"26721317"|"00000000000000286589"|"201705005185254"|"20170508"|"2"|"RB3A019522"|"DOODOO-130-BabiAge DooDoo NightLight 130"|"0000000001"|"0000000.00"
"#28480"|"26722317"|"00000000000000287089"|"201705005186028"|"20170508"|"1"|"RB3A019522"|"DOODOO-130-BabiAge DooDoo NightLight 130"|"0000000001"|"0000000.00"
"#28455"|"26723317"|"00000000000000286699"|"201705005185597"|"20170508"|"1"|"RB3A018809"|"NOPPIES-74331_C166-Noppies Pantalone Fai Navy Baby-56 cm"|"0000000001"|"0000000.00"
"#28455"|"26723317"|"00000000000000286699"|"201705005185597"|"20170508"|"2"|"RB3A018823"|"NOPPIES-74335_C166-Noppies Polo Navy Baby-56 cm"|"0000000001"|"0000000.00"
"#28455"|"26723317"|"00000000000000286699"|"201705005185597"|"20170508"|"3"|"RB3A018840"|"NOPPIES-74344_C166-Noppies Salopette a Righe Blu Navy e Grigio con Body Baby-56 cm"|"0000000001"|"0000000.00"
"#28455"|"26723317"|"00000000000000286699"|"201705005185597"|"20170508"|"4"|"RB3A011289"|"KANGA CARE-KC-KRRUMPSOS-S025-Pannolino Rumparooz Aquarius"|"0000000001"|"0000000.00"
"#28455"|"26723317"|"00000000000000286699"|"201705005185597"|"20170508"|"5"|"RB3A011057"|"BABY BITES-CUBR AZUL S-Culotte Double Face Baby Azzurre e Bianche S"|"0000000001"|"0000000.00"
"#28455"|"26723317"|"00000000000000286699"|"201705005185597"|"20170508"|"6"|"RB3A019437"|"EFFII-5901832946182-Effii Copertina in Cotone Blu"|"0000000001"|"0000000.00"
"#28438"|"26724317"|"00000000000000287129"|"201705005186139"|"20170508"|"1"|"RB3A019667"|"DOODOO-102-BabyAge DooDoo 102 Orsetto Beige"|"0000000001"|"0000000.00"
"#28373"|"26725317"|"00000000000000287139"|"201705005186138"|"20170508"|"1"|"RB3A019667"|"DOODOO-102-BabyAge DooDoo 102 Orsetto Beige"|"0000000001"|"0000000.00"
"#28276"|"26726317"|"00000000000000286769"|"201705005185817"|"20170508"|"1"|"RB3A018645"|"LOLLIPOPS AND MORE-2952349926559-Lollipops and More Licorice Necklace Turquoise"|"0000000001"|"0000000.00"
"#28276"|"26726317"|"00000000000000286769"|"201705005185817"|"20170508"|"2"|"RB3A019668"|"DOODOO-103-BabyAge DooDoo 103 Orsetto Beige"|"0000000001"|"0000000.00"
"#28193"|"26727317"|"00000000000000286629"|"201705005185642"|"20170508"|"1"|"RB3A008919"|"TYRRELL KATZ-Snack Boxes elefanti"|"0000000001"|"0000000.00"
"#28193"|"26727317"|"00000000000000286629"|"201705005185642"|"20170508"|"2"|"RB3A018667"|"LOLLIPOPS AND MORE-2952349927679-Lollipops and More Pacifier Star Dust Clip Pastel Pink"|"0000000001"|"0000000.00"
"#28193"|"26727317"|"00000000000000286629"|"201705005185642"|"20170508"|"3"|"RB3A019457"|"FUNKY BOX-FBTG09-Porta Salviettine Umidificate da Viaggio Funky Box Bianco con Stella Argento"|"0000000001"|"0000000.00"
"#28193"|"26727317"|"00000000000000286629"|"201705005185642"|"20170508"|"4"|"RB3A016476"|"ROCKETBABY-RBP16361-Cesto Passeggino Coniglio"|"0000000001"|"0000000.00"
"#28193"|"26727317"|"00000000000000286629"|"201705005185642"|"20170508"|"5"|"RB3A017418"|"EFFII-5901832942733-Trapunta Avvolgente Neonato Double Face Conigli Rosa e Pois Grigi"|"0000000001"|"0000000.00"
"#28193"|"26727317"|"00000000000000286629"|"201705005185642"|"20170508"|"6"|"RB3A019439"|"EFFII-5901832942801-Effii Telo Mare e Tappeto 2 in 1 Grande con Cuori Rosa"|"0000000001"|"0000000.00"
"#28192"|"26728317"|"00000000000000287039"|"201705005185918"|"20170508"|"1"|"RB3A019666"|"DOODOO-101-BabyAge DooDoo 101 Orsetto Beige"|"0000000001"|"0000000.00"
"#28192"|"26728317"|"00000000000000287039"|"201705005185918"|"20170508"|"2"|"RB3A019520"|"DOODOO-121-BabiAge DooDoo 0121 coniglio a pois beige"|"0000000001"|"0000000.00"
"#28153"|"26729317"|"00000000000000286869"|"201705005186155"|"20170508"|"1"|"RB3A010837"|"CHILDHOME-CHSBG-Set Pappa Verde e Bianco"|"0000000001"|"0000000.00"
"#28153"|"26729317"|"00000000000000286869"|"201705005186155"|"20170508"|"2"|"RB3A019521"|"DOODOO-122-BabiAge DooDoo 0122 coniglio a strisce grigio"|"0000000001"|"0000000.00"
"#28143"|"26730317"|"00000000000000287099"|"201705005186027"|"20170508"|"1"|"RB3A019522"|"DOODOO-130-BabiAge DooDoo NightLight 130"|"0000000001"|"0000000.00"
"#28091"|"26731317"|"00000000000000286419"|"201705005185469"|"20170508"|"1"|"RB3A009314"|"ROCKETBABY-RBP15100303-Cesto per Passeggino Riccio"|"0000000001"|"0000000.00"
"#28091"|"26731317"|"00000000000000286419"|"201705005185469"|"20170508"|"2"|"RB3A017516"|"LILIPUTI-2006002020150-Marsupio Rainbow Line Skully"|"0000000001"|"0000000.00"
"#28931"|"26732317"|"00000000000000286559"|"201705005185289"|"20170508"|"1"|"RB3A016475"|"ROCKETBABY-RBP16360-Cesto Passeggino Narvalo"|"0000000001"|"0000000.00"
"#28920"|"26733317"|"00000000000000286519"|"201705005185245"|"20170508"|"1"|"RB3A015102"|"JELLY CAT-BK4MB-The Magic Bunny Book"|"0000000001"|"0000000.00"
"#28910"|"26734317"|"00000000000000286439"|"201705005185419"|"20170508"|"1"|"RB3A009314"|"ROCKETBABY-RBP15100303-Cesto per Passeggino Riccio"|"0000000001"|"0000000.00"
"#28895"|"26735317"|"00000000000000286839"|"201705005185738"|"20170508"|"1"|"RB3A014986"|"AQUASCALE-94032080-Supporto per vaschetta digitale"|"0000000001"|"0000000.00"
"#28895"|"26735317"|"00000000000000286839"|"201705005185738"|"20170508"|"2"|"RB3A014985"|"AQUASCALE-84231090-Vaschetta digitale con bilancia incorporata"|"0000000001"|"0000000.00"
"#28794"|"26736317"|"00000000000000287069"|"201705005186003"|"20170508"|"1"|"RB3A019521"|"DOODOO-122-BabiAge DooDoo 0122 coniglio a strisce grigio"|"0000000001"|"0000000.00"
"#28469"|"26737317"|"00000000000000286929"|"201705005185939"|"20170508"|"1"|"RB3A017519"|"LILIPUTI-2006002020129-Marsupio Rainbow Line Peony"|"0000000001"|"0000000.00"
"#28439"|"26738317"|"00000000000000286619"|"201705005185665"|"20170508"|"1"|"RB3A017425"|"EFFII-5901832942566-Lenzuolo Con Angoli Grigio e Pois Bianchi 70x140 cm"|"0000000001"|"0000000.00"
"#28439"|"26738317"|"00000000000000286619"|"201705005185665"|"20170508"|"2"|"RB3A019446"|"EFFII-5901832944294-Effii Paracolpi Trapuntato Universale con Pois Bianchi"|"0000000001"|"0000000.00"
"#28439"|"26738317"|"00000000000000286619"|"201705005185665"|"20170508"|"3"|"RB3A019492"|"MAKE MY DAY-BB113-Bavaglia in silicone - Monkey"|"0000000001"|"0000000.00"
"#28439"|"26738317"|"00000000000000286619"|"201705005185665"|"20170508"|"4"|"RB3A008329"|"COQ EN PATE-L13EACCBOBMBBAL-Cappellino Balena L (4-6 anni)"|"0000000001"|"0000000.00"
"#28439"|"26738317"|"00000000000000286619"|"201705005185665"|"20170508"|"5"|"RB3A018712"|"COQ EN PATE-L17EACCBOBHIP-Coq en Pate Cappellino Cavalluccio Marino-L"|"0000000001"|"0000000.00"
"#28412"|"26739317"|"00000000000000286849"|"201705005185147"|"20170508"|"1"|"RB3A019520"|"DOODOO-121-BabiAge DooDoo 0121 coniglio a pois beige"|"0000000001"|"0000000.00"
"#28412"|"26739317"|"00000000000000286849"|"201705005185147"|"20170508"|"2"|"RB3A019608"|"MAKE MY DAY-BB104-Bavaglia in silicone - Lady Bug"|"0000000001"|"0000000.00"
"#28412"|"26739317"|"00000000000000286849"|"201705005185147"|"20170508"|"3"|"RB3A009732"|"HOBEA-4260329478737-Cuscino da allattamento Grigio con Gufetti"|"0000000001"|"0000000.00"
"#28389"|"26740317"|"00000000000000286689"|"201705005185543"|"20170508"|"1"|"RB3A010094"|"PLAY e GO-diamonds_blue-Sacco Portagiochi a Quadretti Bianco e Blu"|"0000000001"|"0000000.00"
"#28389"|"26740317"|"00000000000000286689"|"201705005185543"|"20170508"|"2"|"RB3A019521"|"DOODOO-122-BabiAge DooDoo 0122 coniglio a strisce grigio"|"0000000001"|"0000000.00"
"#28389"|"26740317"|"00000000000000286689"|"201705005185543"|"20170508"|"3"|"RB3A014890"|"ROCKETBABY-RBP16332-Cesto Portagiochi Elefante"|"0000000001"|"0000000.00"
"#28389"|"26740317"|"00000000000000286689"|"201705005185543"|"20170508"|"4"|"RB3A014884"|"ROCKETBABY-RBP16347-Sacco Nanna Balena Verde Menta"|"0000000001"|"0000000.00"
"#28367"|"26741317"|"00000000000000286739"|"201705005185849"|"20170508"|"1"|"RB3A019435"|"EFFII-5901832946151-Effii Copertina in Cotone Rosa"|"0000000001"|"0000000.00"
"#28367"|"26741317"|"00000000000000286739"|"201705005185849"|"20170508"|"2"|"RB3A016477"|"ROCKETBABY-RBP16362-Cesto Passeggino Pecora"|"0000000001"|"0000000.00"
"#28280"|"26742317"|"00000000000000287159"|"201705005186144"|"20170508"|"1"|"RB3A019668"|"DOODOO-103-BabyAge DooDoo 103 Orsetto Beige"|"0000000001"|"0000000.00"
"#28263"|"26743317"|"00000000000000286779"|"201705005185120"|"20170508"|"1"|"RB3A019439"|"EFFII-5901832942801-Effii Telo Mare e Tappeto 2 in 1 Grande con Cuori Rosa"|"0000000001"|"0000000.00"
"#28263"|"26743317"|"00000000000000286779"|"201705005185120"|"20170508"|"2"|"RB3A019470"|"DONE BY DEER-20571-Nido della Tenerezza Rosa"|"0000000001"|"0000000.00"
"#28257"|"26744317"|"00000000000000286679"|"201705005185087"|"20170508"|"1"|"RB3A019520"|"DOODOO-121-BabiAge DooDoo 0121 coniglio a pois beige"|"0000000001"|"0000000.00"
"#28257"|"26744317"|"00000000000000286679"|"201705005185087"|"20170508"|"2"|"RB3A016476"|"ROCKETBABY-RBP16361-Cesto Passeggino Coniglio"|"0000000001"|"0000000.00"
"#28257"|"26744317"|"00000000000000286679"|"201705005185087"|"20170508"|"3"|"RB3A010007"|"CHILDHOME-CCFTBRSP-Borsone Portagiochi Round Grigia e Rosa"|"0000000001"|"0000000.00"
"#28245"|"26745317"|"00000000000000286889"|"201705005185915"|"20170508"|"1"|"RB3A013154"|"BAMBOOM-104-000-059-CAPPELLINO BIMBO baby hat AZZURRO E GRIGIO-TAGLIA-3-6M"|"0000000001"|"0000000.00"
"#28245"|"26745317"|"00000000000000286889"|"201705005185915"|"20170508"|"2"|"RB3A019521"|"DOODOO-122-BabiAge DooDoo 0122 coniglio a strisce grigio"|"0000000001"|"0000000.00"
"#28148"|"26746317"|"00000000000000287109"|"201705005186030"|"20170508"|"1"|"RB3A019522"|"DOODOO-130-BabiAge DooDoo NightLight 130"|"0000000001"|"0000000.00"
"#28142"|"26747317"|"00000000000000286939"|"201705005185975"|"20170508"|"1"|"RB3A019438"|"EFFII-5901832942795-Effii Telo Mare e Tappeto 2 in 1 Grande con Stelle Verdi"|"0000000001"|"0000000.00"
"#27963"|"26748317"|"00000000000000286999"|"201705005186065"|"20170508"|"1"|"RB3A019520"|"DOODOO-121-BabiAge DooDoo 0121 coniglio a pois beige"|"0000000001"|"0000000.00"
"#27957"|"26749317"|"00000000000000287009"|"201705005186064"|"20170508"|"1"|"RB3A019520"|"DOODOO-121-BabiAge DooDoo 0121 coniglio a pois beige"|"0000000001"|"0000000.00"
"#28381"|"26750317"|"00000000000000286759"|"201705005185901"|"20170508"|"1"|"RB3A019633"|"I PLAY-721054-642-Iplay Costumino Pannolino Contenitivo Mix'n Match Royal Viking Sea-18 Mesi"|"0000000001"|"0000000.00"
"#28381"|"26750317"|"00000000000000286759"|"201705005185901"|"20170508"|"2"|"RB3A019609"|"MAKE MY DAY-BB115-Bavaglia in silicone - Sheriff"|"0000000001"|"0000000.00"
"#28381"|"26750317"|"00000000000000286759"|"201705005185901"|"20170508"|"3"|"RB3A018165"|"ELODIE DETAILS-103447-BAVAGLINO BANDANA GRAPHIC DEVOTION"|"0000000001"|"0000000.00"
"#28381"|"26750317"|"00000000000000286759"|"201705005185901"|"20170508"|"4"|"RB3A019436"|"EFFII-5901832946175-Effii Copertina in Cotone Grigio Scuro"|"0000000001"|"0000000.00"
"#27950"|"26751317"|"00000000000000287019"|"201705005186063"|"20170508"|"2"|"RB3A019520"|"DOODOO-121-BabiAge DooDoo 0121 coniglio a pois beige"|"0000000001"|"0000000.00"
"#28063"|"26752317"|"00000000000000286949"|"201705005185973"|"20170508"|"3"|"RB3A019438"|"EFFII-5901832942795-Effii Telo Mare e Tappeto 2 in 1 Grande con Stelle Verdi"|"0000000001"|"0000000.00"
"#28028"|"26753317"|"00000000000000286909"|"201705005185969"|"20170508"|"6"|"RB3A017483"|"EFFII-5901832942153-Cuscino Allattamento Luna Grigio XXL"|"0000000001"|"0000000.00"
"#27932"|"26754317"|"00000000000000287029"|"201705005186062"|"20170508"|"2"|"RB3A019520"|"DOODOO-121-BabiAge DooDoo 0121 coniglio a pois beige"|"0000000001"|"0000000.00"
"#28169"|"26755317"|"00000000000000287219"|"201705005185068"|"20170508"|"1"|"RB3A019660"|"FUNKIT WORLD-SBB-62-Funkit World Borsa da Spiaggia in Silicone Viola"|"0000000001"|"0000020.76"
"#28161"|"26756317"|"00000000000000286609"|"201705005185513"|"20170508"|"1"|"RB3A013436"|"ELODIE DETAILS-103616-Borsa Fasciatoio Forest Flora"|"0000000001"|"0000318.82"
"#28161"|"26756317"|"00000000000000286609"|"201705005185513"|"20170508"|"10"|"RB3A008938"|"TYRRELL KATZ-Ciotola Giungla"|"0000000001"|"0000318.82"
"#28161"|"26756317"|"00000000000000286609"|"201705005185513"|"20170508"|"11"|"RB3A008979"|"TYRRELL KATZ-Posate Giungla"|"0000000001"|"0000318.82"
"#28161"|"26756317"|"00000000000000286609"|"201705005185513"|"20170508"|"12"|"RB3A008980"|"TYRRELL KATZ-Posate elefanti"|"0000000001"|"0000318.82"
"#28161"|"26756317"|"00000000000000286609"|"201705005185513"|"20170508"|"13"|"RB3A008939"|"TYRRELL KATZ-Ciotola elefanti"|"0000000001"|"0000318.82"
"#28161"|"26756317"|"00000000000000286609"|"201705005185513"|"20170508"|"14"|"RB3A008948"|"TYRRELL KATZ-Piatto elefanti"|"0000000001"|"0000318.82"
"#28161"|"26756317"|"00000000000000286609"|"201705005185513"|"20170508"|"17"|"RB3A011095"|"COQ EN PATE-L16ACCBOBMBLEM-Cappellino Lemure S"|"0000000001"|"0000318.82"
"#28161"|"26756317"|"00000000000000286609"|"201705005185513"|"20170508"|"18"|"RB3A008322"|"COQ EN PATE-L13EACCBOBMBGIRCappellino Giraffa M (2-3 anni)"|"0000000001"|"0000318.82"
"#28161"|"26756317"|"00000000000000286609"|"201705005185513"|"20170508"|"19"|"RB3A011099"|"COQ EN PATE-L16ACCBOBMBELE-Cappellino Elefante M"|"0000000001"|"0000318.82"
"#28161"|"26756317"|"00000000000000286609"|"201705005185513"|"20170508"|"2"|"RB3A019654"|"FUNKIT WORLD-SMO-41-Funkit World Formine per la Sabbia in Silicone Blu"|"0000000001"|"0000318.82"
"#28161"|"26756317"|"00000000000000286609"|"201705005185513"|"20170508"|"3"|"RB3A019658"|"FUNKIT WORLD-SSP-55-Funkit World Paletta per la Sabbia in Silicone Rosa"|"0000000001"|"0000318.82"
"#28161"|"26756317"|"00000000000000286609"|"201705005185513"|"20170508"|"4"|"RB3A019652"|"FUNKIT WORLD-SBU-05-Funkit World Secchiello da Spiaggia in Silicone Rosa"|"0000000001"|"0000318.82"
"#28161"|"26756317"|"00000000000000286609"|"201705005185513"|"20170508"|"5"|"RB3A008995"|"TYRRELL KATZ-Bavaglino elefanti"|"0000000001"|"0000318.82"
"#28161"|"26756317"|"00000000000000286609"|"201705005185513"|"20170508"|"6"|"RB3A008994"|"TYRRELL KATZ-Bavaglino Giungla"|"0000000001"|"0000318.82"
"#28161"|"26756317"|"00000000000000286609"|"201705005185513"|"20170508"|"7"|"RB3A008947"|"TYRRELL KATZ-Piatto Giungla"|"0000000001"|"0000318.82"
"#28161"|"26756317"|"00000000000000286609"|"201705005185513"|"20170508"|"8"|"RB3A008919"|"TYRRELL KATZ-Snack Boxes elefanti"|"0000000001"|"0000318.82"
"#28161"|"26756317"|"00000000000000286609"|"201705005185513"|"20170508"|"9"|"RB3A008918"|"TYRRELL KATZ-Snack Boxes Giungla"|"0000000001"|"0000318.82"
"#28124"|"26757317"|"00000000000000287169"|"201705005185179"|"20170508"|"2"|"RB3A019661"|"FUNKIT WORLD-SMR-91-Funkit World Sacca da Spiaggia in Silicone Blu"|"0000000001"|"0000048.64"
"#28124"|"26757317"|"00000000000000287169"|"201705005185179"|"20170508"|"3"|"RB3A019655"|"FUNKIT WORLD-SSP-51-Funkit World Paletta per la Sabbia in Silicone Blu"|"0000000001"|"0000048.64"
"#28124"|"26757317"|"00000000000000287169"|"201705005185179"|"20170508"|"4"|"RB3A019650"|"FUNKIT WORLD-SBU-01-Funkit World Secchiello da Spiaggia in Silicone Blu"|"0000000001"|"0000048.64"
"#28124"|"26757317"|"00000000000000287169"|"201705005185179"|"20170508"|"5"|"RB3A019654"|"FUNKIT WORLD-SMO-41-Funkit World Formine per la Sabbia in Silicone Blu"|"0000000001"|"0000048.64"
"#28101"|"26758317"|"00000000000000287179"|"201705005185172"|"20170508"|"2"|"RB3A019661"|"FUNKIT WORLD-SMR-91-Funkit World Sacca da Spiaggia in Silicone Blu"|"0000000001"|"0000048.64"
"#28101"|"26758317"|"00000000000000287179"|"201705005185172"|"20170508"|"3"|"RB3A019655"|"FUNKIT WORLD-SSP-51-Funkit World Paletta per la Sabbia in Silicone Blu"|"0000000001"|"0000048.64"
"#28101"|"26758317"|"00000000000000287179"|"201705005185172"|"20170508"|"4"|"RB3A019654"|"FUNKIT WORLD-SMO-41-Funkit World Formine per la Sabbia in Silicone Blu"|"0000000001"|"0000048.64"
"#28101"|"26758317"|"00000000000000287179"|"201705005185172"|"20170508"|"5"|"RB3A019650"|"FUNKIT WORLD-SBU-01-Funkit World Secchiello da Spiaggia in Silicone Blu"|"0000000001"|"0000048.64"
"#28094"|"26759317"|"00000000000000286639"|"201705005185527"|"20170508"|"2"|"RB3A009004"|"TYRRELL KATZ-Sacca elefanti"|"0000000001"|"0000080.68"
"#28094"|"26759317"|"00000000000000286639"|"201705005185527"|"20170508"|"3"|"RB3A008996"|"TYRRELL KATZ-Bavaglino giardino segreto"|"0000000001"|"0000080.68"
"#28094"|"26759317"|"00000000000000286639"|"201705005185527"|"20170508"|"4"|"RB3A019520"|"DOODOO-121-BabiAge DooDoo 0121 coniglio a pois beige"|"0000000001"|"0000080.68"
"#28125"|"26760317"|"00000000000000286499"|"201705005185390"|"20170508"|"1"|"RB3A012305"|"EZPZ-HBV-Happy Bowl Verde"|"0000000001"|"0000000.00"
"#28125"|"26760317"|"00000000000000286499"|"201705005185390"|"20170508"|"11"|"RB3A019596"|"BABY ELEPHANT EARS-2026-Baby Elephant Ears Copertina con Macchinine"|"0000000001"|"0000000.00"
"#28125"|"26760317"|"00000000000000286499"|"201705005185390"|"20170508"|"2"|"RB3A012311"|"EZPZ-MMV-Mini Mat Verde"|"0000000001"|"0000000.00"
"#28125"|"26760317"|"00000000000000286499"|"201705005185390"|"20170508"|"3"|"RB3A017492"|"BOON-B10123A-Cucchiaio Dispenser Per La Pappa Verde"|"0000000001"|"0000000.00"
"#28125"|"26760317"|"00000000000000286499"|"201705005185390"|"20170508"|"4"|"RB3A018610"|"BOON-B11177-Pulp Mangiafrutta Dentaruolo Arancione e Azzurro"|"0000000001"|"0000000.00"
"#28125"|"26760317"|"00000000000000286499"|"201705005185390"|"20170508"|"5"|"RB3A018674"|"NUM NUM-NUM100-Num Num Set 2 Cucchiai"|"0000000001"|"0000000.00"
