"SpeNumeroOrdine"|"SpeNumeroProtocollo"|"SpeEtichettaCollo"|"SpeTrackingNumero"|"SpeDataImport"|"SpeRigaOrdine"|"SpeArtCodice"|"SpeArtDescrizione"|"SpeArtQta"|"SpeCostoContrassegno"
"#29417"|"27147317"|"00000000000000292209"|"201705005195429"|"20170512"|"1"|"RB3A015741"|"IIAMO-108-Biberon Go bianco e blu"|"0000000001"|"0000026.86"
"#29408"|"27148317"|"00000000000000292079"|"201705005195684"|"20170512"|"1"|"RB3A009314"|"ROCKETBABY-RBP15100303-Cesto per Passeggino Riccio"|"0000000001"|"0000025.86"
"#29405"|"27149317"|"00000000000000292099"|"201705005195646"|"20170512"|"1"|"RB3A017411"|"BOON-B407-Balena Portaoggetti Per La Vasca"|"0000000001"|"0000049.10"
"#29385"|"27150317"|"00000000000000292089"|"201705005195628"|"20170512"|"1"|"RB3A009312"|"ROCKETBABY-RBP15100301-Cesto per Passeggino Camaleonte"|"0000000001"|"0000025.86"
"#29381"|"27151317"|"00000000000000292189"|"201705005195428"|"20170512"|"1"|"RB3A012781"|"ZOLI-ZL-BC09NTC001-Lima unghie elettrico baby"|"0000000001"|"0000052.86"
"#29369"|"27152317"|"00000000000000292319"|"201705005195402"|"20170512"|"1"|"RB3A019671"|"BUBBLEGUM STUFF-14052-Bubblegum Stuff Babychino Sippy Cup"|"0000000001"|"0000015.86"
"#29346"|"27153317"|"00000000000000292139"|"201705005195633"|"20170512"|"1"|"RB3A016476"|"ROCKETBABY-RBP16361-Cesto Passeggino Coniglio"|"0000000001"|"0000025.86"
"#29344"|"27154317"|"00000000000000292279"|"201705005195323"|"20170512"|"1"|"RB3A019756"|"SUNNYLIFE-SULLFLFP-Luxe Float Flamingo"|"0000000001"|"0000075.86"
"#29315"|"27155317"|"00000000000000292439"|"201705005195263"|"20170512"|"1"|"RB3A019503"|"MUNCHKIN-11054-Papera Gonfiabile da Bagno Munchkin"|"0000000001"|"0000051.72"
"#29315"|"27155317"|"00000000000000292439"|"201705005195263"|"20170512"|"2"|"RB3A018674"|"NUM NUM-NUM100-Num Num Set 2 Cucchiai"|"0000000001"|"0000051.72"
"#29290"|"27156317"|"00000000000000292379"|"201705005195754"|"20170512"|"1"|"RB3A014985"|"AQUASCALE-84231090-Vaschetta digitale con bilancia incorporata"|"0000000001"|"0000094.40"
"#29276"|"27157317"|"00000000000000292449"|"201705005195281"|"20170512"|"1"|"RB3A018674"|"NUM NUM-NUM100-Num Num Set 2 Cucchiai"|"0000000001"|"0000020.86"
"#29067"|"27158317"|"00000000000000292469"|"201705005195297"|"20170512"|"1"|"RB3A019451"|"FUNKY BOX-FB08-Porta Salviettine Umidificate Funky Box Fucsia con Cuore Bianco"|"0000000001"|"0000037.72"
"#29067"|"27158317"|"00000000000000292469"|"201705005195297"|"20170512"|"2"|"RB3A019489"|"MAKE MY DAY-BB110-Bavaglia in silicone - Owl"|"0000000001"|"0000037.72"
"#28943"|"27159317"|"00000000000000292409"|"201705005195273"|"20170512"|"1"|"RB3A017492"|"BOON-B10123A-Cucchiaio Dispenser Per La Pappa Verde"|"0000000001"|"0000019.86"
"#28785"|"27160317"|"00000000000000291959"|"201705005195477"|"20170512"|"1"|"RB3A011311"|"KANGA CARE-KC-C4025SP-Pannolino Rumparooz Quinn"|"0000000001"|"0000153.42"
"#28785"|"27160317"|"00000000000000291959"|"201705005195477"|"20170512"|"2"|"RB3A019472"|"DONE BY DEER-40621-Palestrina Gioco Rosa"|"0000000001"|"0000153.42"
"#29411"|"27161317"|"00000000000000292159"|"201705005195617"|"20170512"|"1"|"RB3A014896"|"ROCKETBABY-RBP16338-Scatola Portagiochi Elefante"|"0000000001"|"0000000.00"
"#29411"|"27161317"|"00000000000000292159"|"201705005195617"|"20170512"|"2"|"RB3A014894"|"ROCKETBABY-RBP16336-Scatola Portagiochi Balena"|"0000000001"|"0000000.00"
"#29402"|"27162317"|"00000000000000292479"|"201705005195278"|"20170512"|"1"|"RB3A019451"|"FUNKY BOX-FB08-Porta Salviettine Umidificate Funky Box Fucsia con Cuore Bianco"|"0000000001"|"0000000.00"
"#29400"|"27163317"|"00000000000000292269"|"201705005195360"|"20170512"|"1"|"RB3A007730"|"COQ EN PATE-L15SACRUKMBPAN-Sacca Panda"|"0000000001"|"0000000.00"
"#29400"|"27163317"|"00000000000000292269"|"201705005195360"|"20170512"|"2"|"RB3A019744"|"SUNNYLIFE-SU4BUWXB-Fishy Wind Up Bubbles"|"0000000001"|"0000000.00"
"#29394"|"27164317"|"00000000000000292069"|"201705005195724"|"20170512"|"1"|"RB3A011618"|"BIG MOUTH-BMPFGBG-Ciambellone gonfiabile XXL Orsetto Verde"|"0000000001"|"0000000.00"
"#29394"|"27164317"|"00000000000000292069"|"201705005195724"|"20170512"|"2"|"RB3A017861"|"TYRRELL KATZ-03BT2-Under The Sea Drinking Bottle"|"0000000001"|"0000000.00"
"#29394"|"27164317"|"00000000000000292069"|"201705005195724"|"20170512"|"3"|"RB3A009821"|"FCTRY-GLSTA25-Occhiali da Sole Baby Gialli 0-2 anni"|"0000000001"|"0000000.00"
"#29388"|"27165317"|"00000000000000292039"|"201705005195812"|"20170512"|"1"|"RB3A015742"|"IIAMO-703-Cartucce termiche per biberon autoriscaldante"|"0000000002"|"0000000.00"
"#29388"|"27165317"|"00000000000000292039"|"201705005195812"|"20170512"|"2"|"RB3A015741"|"IIAMO-108-Biberon Go bianco e blu"|"0000000001"|"0000000.00"
"#29388"|"27165317"|"00000000000000292039"|"201705005195812"|"20170512"|"3"|"RB3A015202"|"INNOBABY-N-AQ-H02-Innobaby - AquaHeat - HOT Heat Pack - set of 5"|"0000000001"|"0000000.00"
"#29388"|"27165317"|"00000000000000292039"|"201705005195812"|"20170512"|"4"|"RB3A015200"|"INNOBABY-IN-AQ-F02-Innobaby - AquaHeat Food Warmer - MEGA - 22 oz"|"0000000001"|"0000000.00"
"#29378"|"27166317"|"00000000000000292259"|"201705005195334"|"20170512"|"1"|"RB3A012292"|"A LITTLE LOVELY COMPANY-LTBW032-Box Lampada A4 Lightbox per scritte Bianca"|"0000000001"|"0000000.00"
"#29352"|"27167317"|"00000000000000292309"|"201705005195407"|"20170512"|"1"|"RB3A019671"|"BUBBLEGUM STUFF-14052-Bubblegum Stuff Babychino Sippy Cup"|"0000000002"|"0000000.00"
"#29350"|"27168317"|"00000000000000292299"|"201705005195320"|"20170512"|"1"|"RB3A019740"|"SUNNYLIFE-SUGCAKFL-Flamingo Cake Candles"|"0000000001"|"0000000.00"
"#29349"|"27169317"|"00000000000000292179"|"201705005195611"|"20170512"|"1"|"RB3A014887"|"ROCKETBABY-RBP16350-Sacco Nanna Balena Blu"|"0000000001"|"0000000.00"
"#29345"|"27170317"|"00000000000000292239"|"201705005195364"|"20170512"|"1"|"RB3A013650"|"BLADEeROSE-5060257466030-Leggings Fifi Flamingo 2-3y"|"0000000001"|"0000000.00"
"#29317"|"27171317"|"00000000000000292419"|"201705005195275"|"20170512"|"1"|"RB3A017492"|"BOON-B10123A-Cucchiaio Dispenser Per La Pappa Verde"|"0000000001"|"0000000.00"
"#29317"|"27171317"|"00000000000000292419"|"201705005195275"|"20170512"|"2"|"RB3A018610"|"BOON-B11177-Pulp Mangiafrutta Dentaruolo Arancione e Azzurro"|"0000000001"|"0000000.00"
"#29273"|"27172317"|"00000000000000292389"|"201705005195752"|"20170512"|"1"|"RB3A014985"|"AQUASCALE-84231090-Vaschetta digitale con bilancia incorporata"|"0000000001"|"0000000.00"
"#29264"|"27173317"|"00000000000000291979"|"201705005195839"|"20170512"|"1"|"RB3A012362"|"SUPER PETIT-MPLATEROBO002-Piatto Blu in melamina"|"0000000001"|"0000000.00"
"#29264"|"27173317"|"00000000000000291979"|"201705005195839"|"20170512"|"2"|"RB3A012495"|"BLOOMINGVILLE-47305090-Piattino Toby"|"0000000001"|"0000000.00"
"#29264"|"27173317"|"00000000000000291979"|"201705005195839"|"20170512"|"3"|"RB3A012506"|"BLOOMINGVILLE-47305112-Piattino a scomparti Nelly"|"0000000001"|"0000000.00"
"#29264"|"27173317"|"00000000000000291979"|"201705005195839"|"20170512"|"4"|"RB3A012310"|"EZPZ-MMC-Mini Mat Corallo"|"0000000001"|"0000000.00"
"#29264"|"27173317"|"00000000000000291979"|"201705005195839"|"20170512"|"5"|"RB3A018674"|"NUM NUM-NUM100-Num Num Set 2 Cucchiai"|"0000000001"|"0000000.00"
"#29264"|"27173317"|"00000000000000291979"|"201705005195839"|"20170512"|"6"|"RB3A018610"|"BOON-B11177-Pulp Mangiafrutta Dentaruolo Arancione e Azzurro"|"0000000001"|"0000000.00"
"#29259"|"27174317"|"00000000000000291989"|"201705005195739"|"20170512"|"1"|"RB3A018674"|"NUM NUM-NUM100-Num Num Set 2 Cucchiai"|"0000000001"|"0000000.00"
"#29259"|"27174317"|"00000000000000291989"|"201705005195739"|"20170512"|"2"|"RB3A012310"|"EZPZ-MMC-Mini Mat Corallo"|"0000000001"|"0000000.00"
"#29259"|"27174317"|"00000000000000291989"|"201705005195739"|"20170512"|"3"|"RB3A012311"|"EZPZ-MMV-Mini Mat Verde"|"0000000001"|"0000000.00"
"#29239"|"27175317"|"00000000000000292169"|"201705005195605"|"20170512"|"1"|"RB3A014891"|"ROCKETBABY-RBP16333-Scatola Portagiochi Flamingo"|"0000000001"|"0000000.00"
"#29239"|"27175317"|"00000000000000292169"|"201705005195605"|"20170512"|"2"|"RB3A014896"|"ROCKETBABY-RBP16338-Scatola Portagiochi Elefante"|"0000000001"|"0000000.00"
"#29239"|"27175317"|"00000000000000292169"|"201705005195605"|"20170512"|"3"|"RB3A014893"|"ROCKETBABY-RBP16335-Scatola Portagiochi Leone"|"0000000001"|"0000000.00"
"#29208"|"27176317"|"00000000000000291999"|"201705005195750"|"20170512"|"1"|"RB3A014892"|"ROCKETBABY-RBP16334-Scatola Portagiochi Zebra"|"0000000001"|"0000000.00"
"#29208"|"27176317"|"00000000000000291999"|"201705005195750"|"20170512"|"2"|"RB3A018611"|"BOON-B11179-Pulp Mangiafrutta Dentaruolo Verde e Azzurro"|"0000000001"|"0000000.00"
"#29208"|"27176317"|"00000000000000291999"|"201705005195750"|"20170512"|"3"|"RB3A012346"|"CUPCAKE BABIES-VDBR06-Cappello Anti Schiuma Rosa"|"0000000001"|"0000000.00"
"#29140"|"27177317"|"00000000000000292339"|"201705005195503"|"20170512"|"1"|"RB3A014986"|"AQUASCALE-94032080-Supporto per vaschetta digitale"|"0000000001"|"0000000.00"
"#29140"|"27177317"|"00000000000000292339"|"201705005195503"|"20170512"|"2"|"RB3A019670"|"BUBBLEGUM STUFF-13591-Bubblegum Stuff Rocket Baby Bottle"|"0000000001"|"0000000.00"
"#29140"|"27177317"|"00000000000000292339"|"201705005195503"|"20170512"|"3"|"RB3A010870"|"FCTRY-BBSTA03-Bavaglino Bandana set Nero/Bianco/Grigio"|"0000000001"|"0000000.00"
"#29137"|"27178317"|"00000000000000292009"|"201705005195746"|"20170512"|"1"|"RB3A012355"|"CUPCAKE BABIES-CCBBT02-Set Baby Bath 2 in 1 Turchese"|"0000000001"|"0000000.00"
"#29137"|"27178317"|"00000000000000292009"|"201705005195746"|"20170512"|"2"|"RB3A017491"|"BOON-B10122A-Cucchiaio Dispenser Per La Pappa Azzurro"|"0000000001"|"0000000.00"
"#29137"|"27178317"|"00000000000000292009"|"201705005195746"|"20170512"|"3"|"RB3A018674"|"NUM NUM-NUM100-Num Num Set 2 Cucchiai"|"0000000001"|"0000000.00"
"#29118"|"27179317"|"00000000000000291969"|"201705005195748"|"20170512"|"1"|"RB3A011311"|"KANGA CARE-KC-C4025SP-Pannolino Rumparooz Quinn"|"0000000001"|"0000000.00"
"#29118"|"27179317"|"00000000000000291969"|"201705005195748"|"20170512"|"2"|"RB3A019631"|"I PLAY-721054-642-Iplay Costumino Pannolino Contenitivo Mix'n Match Royal Viking Sea-6 Mesi"|"0000000001"|"0000000.00"
"#29109"|"27180317"|"00000000000000292359"|"201705005195311"|"20170512"|"1"|"RB3A011294"|"KANGA CARE-KC-KRRUMPSOS-S030-Pannolino Rumparooz Orchid"|"0000000001"|"0000000.00"
"#29103"|"27181317"|"00000000000000291949"|"201705005195741"|"20170512"|"1"|"RB3A011295"|"KANGA CARE-KC-C4022SP-Pannolino Rumparooz Peacock"|"0000000001"|"0000000.00"
"#29103"|"27181317"|"00000000000000291949"|"201705005195741"|"20170512"|"2"|"RB3A011293"|"KANGA CARE-KC-KRRUMPSOS-S032-Pannolino Rumparooz Nautical"|"0000000001"|"0000000.00"
"#29096"|"27182317"|"00000000000000292509"|"201705005195257"|"20170512"|"1"|"RB3A019684"|"REAL SHADES-RK-0EXPRYGR-Occhiali da Sole Baby Royal Green"|"0000000001"|"0000000.00"
"#29073"|"27183317"|"00000000000000292369"|"201705005195293"|"20170512"|"1"|"RB3A011294"|"KANGA CARE-KC-KRRUMPSOS-S030-Pannolino Rumparooz Orchid"|"0000000001"|"0000000.00"
"#29073"|"27183317"|"00000000000000292369"|"201705005195293"|"20170512"|"2"|"RB3A011318"|"KANGA CARE-KC-KRWETB_OS-S030-Wet Bag Portapannolini Orchid"|"0000000001"|"0000000.00"
"#29073"|"27183317"|"00000000000000292369"|"201705005195293"|"20170512"|"3"|"RB3A011307"|"KANGA CARE-KC-KRRUMPSOS-P118-Pannolino Rumparooz Destiny"|"0000000001"|"0000000.00"
"#28942"|"27184317"|"00000000000000292399"|"201705005195538"|"20170512"|"1"|"RB3A014986"|"AQUASCALE-94032080-Supporto per vaschetta digitale"|"0000000001"|"0000000.00"
"#28869"|"27185317"|"00000000000000292029"|"201705005195814"|"20170512"|"1"|"RB3A017495"|"BOON-B373-Scolaposate e Scola Biberon Quadrato"|"0000000001"|"0000000.00"
"#28869"|"27185317"|"00000000000000292029"|"201705005195814"|"20170512"|"2"|"RB3A014891"|"ROCKETBABY-RBP16333-Scatola Portagiochi Flamingo"|"0000000001"|"0000000.00"
"#28869"|"27185317"|"00000000000000292029"|"201705005195814"|"20170512"|"3"|"RB3A014892"|"ROCKETBABY-RBP16334-Scatola Portagiochi Zebra"|"0000000001"|"0000000.00"
"#28869"|"27185317"|"00000000000000292029"|"201705005195814"|"20170512"|"4"|"RB3A014896"|"ROCKETBABY-RBP16338-Scatola Portagiochi Elefante"|"0000000001"|"0000000.00"
"#28869"|"27185317"|"00000000000000292029"|"201705005195814"|"20170512"|"5"|"RB3A014894"|"ROCKETBABY-RBP16336-Scatola Portagiochi Balena"|"0000000001"|"0000000.00"
"#28825"|"27186317"|"00000000000000291899"|"201705005195742"|"20170512"|"1"|"RB3A009478"|"HOBEA-4260329471684-Babbucce Farfalla Pauline 12-18 Mesi"|"0000000001"|"0000000.00"
"#28825"|"27186317"|"00000000000000291899"|"201705005195742"|"20170512"|"2"|"RB3A019608"|"MAKE MY DAY-BB104-Bavaglia in silicone - Lady Bug"|"0000000001"|"0000000.00"
"#28818"|"27187317"|"00000000000000291889"|"201705005195464"|"20170512"|"1"|"RB3A019486"|"DONE BY DEER-20645-Paracolpi per Letto Happy Dots Zoopreme 180 cm con Velcro Grigio"|"0000000001"|"0000000.00"
"#28818"|"27187317"|"00000000000000291889"|"201705005195464"|"20170512"|"2"|"RB3A018407"|"A LITTLE LOVELY COMPANY-CHRF002-Set 2 Stampelle Appendiabiti Volpe e Procione"|"0000000001"|"0000000.00"
"#28818"|"27187317"|"00000000000000291889"|"201705005195464"|"20170512"|"3"|"RB3A015366"|"ITZY RITZY-IR-MSWB8200-Set 2 buste porta-cibo farfalla"|"0000000001"|"0000000.00"
"#28818"|"27187317"|"00000000000000291889"|"201705005195464"|"20170512"|"4"|"RB3A008977"|"TYRRELL KATZ-Posate dinosauri"|"0000000001"|"0000000.00"
"#28711"|"27188317"|"00000000000000291939"|"201705005195863"|"20170512"|"1"|"RB3A011288"|"LOVE MAE-LVYH009-Set Pappa Frutta e Verdura 5 pz"|"0000000001"|"0000000.00"
"#28711"|"27188317"|"00000000000000291939"|"201705005195863"|"20170512"|"2"|"RB3A011285"|"LOVE MAE-LVYH006-Set Pappa Fata del Giardino 5 pz"|"0000000001"|"0000000.00"
"#28711"|"27188317"|"00000000000000291939"|"201705005195863"|"20170512"|"3"|"RB3A019669"|"BUBBLEGUM STUFF-12435-Bubblegum Stuff Gentleman Baby Bottle Champagne Flute"|"0000000002"|"0000000.00"
"#28711"|"27188317"|"00000000000000291939"|"201705005195863"|"20170512"|"4"|"RB3A016476"|"ROCKETBABY-RBP16361-Cesto Passeggino Coniglio"|"0000000001"|"0000000.00"
"#28711"|"27188317"|"00000000000000291939"|"201705005195863"|"20170512"|"5"|"RB3A012428"|"TOTSEAT-TOTSZES-Seggiolone da viaggio compact Grigio"|"0000000001"|"0000000.00"
"#28711"|"27188317"|"00000000000000291939"|"201705005195863"|"20170512"|"6"|"RB3A012430"|"TOTSEAT-TOTSCHO-Seggiolone da viaggio compact Marrone"|"0000000001"|"0000000.00"
"#28711"|"27188317"|"00000000000000291939"|"201705005195863"|"20170512"|"7"|"RB3A016477"|"ROCKETBABY-RBP16362-Cesto Passeggino Pecora"|"0000000001"|"0000000.00"
"#28711"|"27188317"|"00000000000000291939"|"201705005195863"|"20170512"|"8"|"RB3A019487"|"MAKE MY DAY-BB100-Bavaglia in silicone - Tiffany Blue"|"0000000001"|"0000000.00"
"#28711"|"27188317"|"00000000000000291939"|"201705005195863"|"20170512"|"9"|"RB3A019488"|"MAKE MY DAY-BB108-Bavaglia in silicone - Lilac"|"0000000001"|"0000000.00"
"#28519"|"27189317"|"00000000000000291919"|"201705005195787"|"20170512"|"1"|"RB3A012346"|"CUPCAKE BABIES-VDBR06-Cappello Anti Schiuma Rosa"|"0000000001"|"0000000.00"
"#28519"|"27189317"|"00000000000000291919"|"201705005195787"|"20170512"|"2"|"RB3A010837"|"CHILDHOME-CHSBG-Set Pappa Verde e Bianco"|"0000000001"|"0000000.00"
"#28519"|"27189317"|"00000000000000291919"|"201705005195787"|"20170512"|"3"|"RB3A012825"|"BROTHER MAX-71282PG2-Tazzina impugnatura facile rosa e verde"|"0000000001"|"0000000.00"
"#28519"|"27189317"|"00000000000000291919"|"201705005195787"|"20170512"|"4"|"RB3A012828"|"BROTHER MAX-71237BG2-Set pappa impugnatura facile verde e blu"|"0000000001"|"0000000.00"
"#28519"|"27189317"|"00000000000000291919"|"201705005195787"|"20170512"|"5"|"RB3A012819"|"BROTHER MAX-71152PK2-Set 2 bavaglini contenitori rosa e verde"|"0000000001"|"0000000.00"
"#28519"|"27189317"|"00000000000000291919"|"201705005195787"|"20170512"|"6"|"RB3A017493"|"BOON-B10124A-Cucchiaio Dispenser Per La Pappa Arancio"|"0000000001"|"0000000.00"
"#28519"|"27189317"|"00000000000000291919"|"201705005195787"|"20170512"|"7"|"RB3A018610"|"BOON-B11177-Pulp Mangiafrutta Dentaruolo Arancione e Azzurro"|"0000000001"|"0000000.00"
"#28519"|"27189317"|"00000000000000291919"|"201705005195787"|"20170512"|"8"|"RB3A018674"|"NUM NUM-NUM100-Num Num Set 2 Cucchiai"|"0000000001"|"0000000.00"
"#28519"|"27189317"|"00000000000000291919"|"201705005195787"|"20170512"|"9"|"RB3A018675"|"NUM NUM-NUM300-Num Num Beginner Bowl"|"0000000001"|"0000000.00"
"#28518"|"27190317"|"00000000000000291909"|"201705005195880"|"20170512"|"1"|"RB3A018287"|"KUK-FS371-12-Body Manica corta  con Foglie Menta-6-12 Mesi"|"0000000001"|"0000000.00"
"#28518"|"27190317"|"00000000000000291909"|"201705005195880"|"20170512"|"2"|"RB3A012506"|"BLOOMINGVILLE-47305112-Piattino a scomparti Nelly"|"0000000001"|"0000000.00"
"#28518"|"27190317"|"00000000000000291909"|"201705005195880"|"20170512"|"3"|"RB3A019608"|"MAKE MY DAY-BB104-Bavaglia in silicone - Lady Bug"|"0000000001"|"0000000.00"
"#28518"|"27190317"|"00000000000000291909"|"201705005195880"|"20170512"|"4"|"RB3A010115"|"ELODIE DETAILS-103761-Copripasseggino Bedouin Stories"|"0000000001"|"0000000.00"
"#28518"|"27190317"|"00000000000000291909"|"201705005195880"|"20170512"|"5"|"RB3A019601"|"BABY ELEPHANT EARS-1038-Baby Elephant Ears Cuscino Ergonomico Amici del Bosco"|"0000000001"|"0000000.00"
"#28518"|"27190317"|"00000000000000291909"|"201705005195880"|"20170512"|"6"|"RB3A010502"|"KUK-FL328-12-Body a maniche lunghe Balena Rosa 6-12 mesi"|"0000000001"|"0000000.00"
"#28489"|"27191317"|"00000000000000292019"|"201705005195740"|"20170512"|"1"|"RB3A018661"|"LOLLIPOPS AND MORE-2952349927853-Lollipops and More Macaron Shorty Necklace Turquoise"|"0000000001"|"0000000.00"
"#28489"|"27191317"|"00000000000000292019"|"201705005195740"|"20170512"|"2"|"RB3A018644"|"LOLLIPOPS AND MORE-2952349926542-Lollipops and More Licorice Necklace Violet Red"|"0000000001"|"0000000.00"
"#28489"|"27191317"|"00000000000000292019"|"201705005195740"|"20170512"|"3"|"RB3A014888"|"ROCKETBABY-RBP16330-Cesto Portagiochi Unicorno"|"0000000001"|"0000000.00"
"#28489"|"27191317"|"00000000000000292019"|"201705005195740"|"20170512"|"4"|"RB3A019489"|"MAKE MY DAY-BB110-Bavaglia in silicone - Owl"|"0000000001"|"0000000.00"
"#28489"|"27191317"|"00000000000000292019"|"201705005195740"|"20170512"|"5"|"RB3A019608"|"MAKE MY DAY-BB104-Bavaglia in silicone - Lady Bug"|"0000000001"|"0000000.00"
"#29403"|"27192317"|"00000000000000292129"|"201705005195634"|"20170512"|"1"|"RB3A016476"|"ROCKETBABY-RBP16361-Cesto Passeggino Coniglio"|"0000000001"|"0000000.00"
"#29379"|"27193317"|"00000000000000292119"|"201705005195621"|"20170512"|"1"|"RB3A016477"|"ROCKETBABY-RBP16362-Cesto Passeggino Pecora"|"0000000001"|"0000000.00"
"#29375"|"27194317"|"00000000000000292149"|"201705005195638"|"20170512"|"1"|"RB3A016475"|"ROCKETBABY-RBP16360-Cesto Passeggino Narvalo"|"0000000001"|"0000000.00"
"#29365"|"27195317"|"00000000000000292289"|"201705005195328"|"20170512"|"1"|"RB3A019742"|"SUNNYLIFE-SUVFLAXP-Garden Flamingos"|"0000000001"|"0000000.00"
"#29362"|"27196317"|"00000000000000292249"|"201705005195345"|"20170512"|"1"|"RB3A012558"|"ELODIE DETAILS-103619-Borsa Fasciatoio Gilded Grey"|"0000000001"|"0000000.00"
"#29347"|"27197317"|"00000000000000292109"|"201705005195660"|"20170512"|"1"|"RB3A011281"|"LOVE MAE-LVYJ004-Set Pappa Cena da sogno 4 pz"|"0000000001"|"0000000.00"
"#29202"|"27198317"|"00000000000000292459"|"201705005195282"|"20170512"|"1"|"RB3A018674"|"NUM NUM-NUM100-Num Num Set 2 Cucchiai"|"0000000001"|"0000000.00"
"#29177"|"27199317"|"00000000000000292429"|"201705005195265"|"20170512"|"1"|"RB3A018610"|"BOON-B11177-Pulp Mangiafrutta Dentaruolo Arancione e Azzurro"|"0000000001"|"0000000.00"
"#29078"|"27200317"|"00000000000000292219"|"201705005195397"|"20170512"|"1"|"RB20012R"|"Duux-DUBP01P-Proiettore per Bambini Rosa"|"0000000001"|"0000000.00"
"#29078"|"27200317"|"00000000000000292219"|"201705005195397"|"20170512"|"2"|"RB3A010114"|"ELODIE DETAILS-103313-Copertina Bambu Colori del Vento"|"0000000001"|"0000000.00"
"#29035"|"27201317"|"00000000000000291929"|"201705005195745"|"20170512"|"1"|"RB3A010947"|"KUK-MS007-Occhiali da Sole Minisquids Rossi"|"0000000001"|"0000000.00"
"#29035"|"27201317"|"00000000000000291929"|"201705005195745"|"20170512"|"2"|"RB3A012311"|"EZPZ-MMV-Mini Mat Verde"|"0000000001"|"0000000.00"
"#29035"|"27201317"|"00000000000000291929"|"201705005195745"|"20170512"|"3"|"RB3A018611"|"BOON-B11179-Pulp Mangiafrutta Dentaruolo Verde e Azzurro"|"0000000001"|"0000000.00"
"#29035"|"27201317"|"00000000000000291929"|"201705005195745"|"20170512"|"4"|"RB3A018674"|"NUM NUM-NUM100-Num Num Set 2 Cucchiai"|"0000000001"|"0000000.00"
"#28982"|"27202317"|"00000000000000292059"|"201705005195443"|"20170512"|"1"|"RB3A018674"|"NUM NUM-NUM100-Num Num Set 2 Cucchiai"|"0000000001"|"0000000.00"
"#28982"|"27202317"|"00000000000000292059"|"201705005195443"|"20170512"|"2"|"RB3A018675"|"NUM NUM-NUM300-Num Num Beginner Bowl"|"0000000001"|"0000000.00"
"#28982"|"27202317"|"00000000000000292059"|"201705005195443"|"20170512"|"3"|"RB3A019674"|"TOTSEAT-TOTSDEN-Seggiolone da Viaggio Denim"|"0000000001"|"0000000.00"
"#28982"|"27202317"|"00000000000000292059"|"201705005195443"|"20170512"|"4"|"RB3A019668"|"DOODOO-103-BabyAge DooDoo 103 Orsetto Beige"|"0000000001"|"0000000.00"
"#28982"|"27202317"|"00000000000000292059"|"201705005195443"|"20170512"|"5"|"RB3A019669"|"BUBBLEGUM STUFF-12435-Bubblegum Stuff Gentleman Baby Bottle Champagne Flute"|"0000000001"|"0000000.00"
"#28904"|"27203317"|"00000000000000292349"|"201705005195315"|"20170512"|"1"|"RB3A011291"|"KANGA CARE-KC-KRRUMPSOS-S029-Pannolino Rumparooz Dandelion"|"0000000001"|"0000000.00"
"#28828"|"27204317"|"00000000000000292329"|"201705005195412"|"20170512"|"1"|"RB3A016494"|"KANGA CARE-KCKRLLNZSXSM402-Set 2 Mutandine Di Transizione Charlie e Quinn L"|"0000000001"|"0000000.00"
"#28828"|"27204317"|"00000000000000292329"|"201705005195412"|"20170512"|"2"|"RB3A010869"|"FCTRY-GLSTA35-Occhiali da Sole Baby Gialli 3-6 anni"|"0000000001"|"0000000.00"
"#28742"|"27205317"|"00000000000000292049"|"201705005195737"|"20170512"|"1"|"RB3A016475"|"ROCKETBABY-RBP16360-Cesto Passeggino Narvalo"|"0000000001"|"0000000.00"
"#28742"|"27205317"|"00000000000000292049"|"201705005195737"|"20170512"|"2"|"RB3A019636"|"I PLAY-721054-816-Iplay Costumino Pannolino Contenitivo Mix'n Match Grigio-6 Mesi"|"0000000001"|"0000000.00"
"#28742"|"27205317"|"00000000000000292049"|"201705005195737"|"20170512"|"3"|"RB3A019631"|"I PLAY-721054-642-Iplay Costumino Pannolino Contenitivo Mix'n Match Royal Viking Sea-6 Mesi"|"0000000001"|"0000000.00"
"#28692"|"27206317"|"00000000000000292489"|"201705005195246"|"20170512"|"1"|"RB3A019489"|"MAKE MY DAY-BB110-Bavaglia in silicone - Owl"|"0000000001"|"0000000.00"
"#28692"|"27206317"|"00000000000000292489"|"201705005195246"|"20170512"|"2"|"RB3A019601"|"BABY ELEPHANT EARS-1038-Baby Elephant Ears Cuscino Ergonomico Amici del Bosco"|"0000000001"|"0000000.00"
"#27812"|"27207317"|"00000000000000292499"|"201705005195228"|"20170512"|"6"|"RB3A019512"|"STORKSAK-SK8178-Storksak Packing Blocks Grey"|"0000000001"|"0000000.00"
"#28444"|"27208317"|"00000000000000292229"|"201705005195393"|"20170512"|"1"|"RB3A008982"|"TYRRELL KATZ-Vassoio con scomparti motori"|"0000000001"|"0000148.13"
"#28444"|"27208317"|"00000000000000292229"|"201705005195393"|"20170512"|"10"|"RB3A013668"|"BLADEeROSE-5060257464159-Leggings Hedgehog 0-6m"|"0000000001"|"0000148.13"
"#28444"|"27208317"|"00000000000000292229"|"201705005195393"|"20170512"|"12"|"RB3A013851"|"BLADEeROSE-5060257466207-Leggings Red Daisy 0-6m"|"0000000001"|"0000148.13"
"#28444"|"27208317"|"00000000000000292229"|"201705005195393"|"20170512"|"2"|"RB3A008983"|"TYRRELL KATZ-Vassoio con scomparti dinosauri"|"0000000001"|"0000148.13"
"#28444"|"27208317"|"00000000000000292229"|"201705005195393"|"20170512"|"3"|"RB3A008977"|"TYRRELL KATZ-Posate dinosauri"|"0000000001"|"0000148.13"
"#28444"|"27208317"|"00000000000000292229"|"201705005195393"|"20170512"|"4"|"RB3A008979"|"TYRRELL KATZ-Posate Giungla"|"0000000001"|"0000148.13"
"#28444"|"27208317"|"00000000000000292229"|"201705005195393"|"20170512"|"5"|"RB3A008325"|"COQ EN PATE-L13EACCBOBMBLIO-Cappellino Leone M (2-3 anni)"|"0000000001"|"0000148.13"
"#28444"|"27208317"|"00000000000000292229"|"201705005195393"|"20170512"|"8"|"RB3A013477"|"BLADEeROSE-5060257461554-Hoodie Star Grey 2-3y"|"0000000001"|"0000148.13"
"#28444"|"27208317"|"00000000000000292229"|"201705005195393"|"20170512"|"9"|"RB3A013856"|"BLADEeROSE-5060257466535-Socks Red Daisy 0-6m"|"0000000001"|"0000148.13"
"#28462"|"27209317"|"00000000000000292199"|"201705005195596"|"20170512"|"1"|"RB3A016594"|"THE REWARD BOX-700461569534-La Cassetta Delle Fate"|"0000000001"|"0000000.00"
"#28462"|"27209317"|"00000000000000292199"|"201705005195596"|"20170512"|"2"|"RB3A012383"|"THE MAGIC DOOR STORE-0700461482536-Magiche Impronte"|"0000000001"|"0000000.00"
"#28462"|"27209317"|"00000000000000292199"|"201705005195596"|"20170512"|"4"|"RB3A015260"|"MINIROOM-MR-B-001-Pupazzo Little Bunny Mint"|"0000000001"|"0000000.00"
"#28462"|"27209317"|"00000000000000292199"|"201705005195596"|"20170512"|"5"|"RB3A017401"|"LITECUP-5060168240019-Bicchierone Che Si Illumina Bianco"|"0000000001"|"0000000.00"
"#28462"|"27209317"|"00000000000000292199"|"201705005195596"|"20170512"|"6"|"RB3A012382"|"THE MAGIC DOOR STORE-0700461482512-La magica scaletta"|"0000000001"|"0000000.00"
"#28462"|"27209317"|"00000000000000292199"|"201705005195596"|"20170512"|"7"|"RB3A012380"|"THE MAGIC DOOR STORE-0700461482529-La magica panchina"|"0000000001"|"0000000.00"
"#28462"|"27209317"|"00000000000000292199"|"201705005195596"|"20170512"|"8"|"RB3A012384"|"THE MAGIC DOOR STORE-0700461482451-My Pink Elf Door"|"0000000001"|"0000000.00"
